,BANK NAME,IFSC,OFFICE,ADDRESS,DISTRICT,CITY,STATE,PHONE
2345,ICICI BANK LIMITED,ICIC0002480,KARNAL SEC 3,ICICI BANK LTD SCO 6 INDUSTRIAL AREA SECTOR 3 KARNAL,KARNAL,KARNAL,HARYANA,8295908320
2346,ICICI BANK LIMITED,ICIC0002481,KHARDAH,24 BY 18 B T ROAD KHARDAH KOLKATA 700116,KOLKATA,KOLKATA,WEST BENGAL,0
2347,ICICI BANK LIMITED,ICIC0002482,OLAVAKKODE,ICICI BANK LTD POOPPAS ARCADE MAIN ROAD OLAVAKKODE PALAKKAD - 678002,PALAKKAD,PALAKKAD,KERALA,9846881252
2348,ICICI BANK LIMITED,ICIC0002483,PANAMPILLY NAGAR,"ICICI BANK LTD., MANNA, NEAR AVENUE CENTRE, PANAMPILLY NAGAR, KOCHI - 682036, KERALA",ERNAKULAM,KOCHI,KERALA,0
2349,ICICI BANK LIMITED,ICIC0002484,PACHALAM,"ICICI BANK LTD., IDASSERIL CHAMBERS, LINK PARK, POTTAKUZHI ROAD, PACHALAM, KOCHI - 682012, KERALA",ERNAKULAM,KOCHI,KERALA,0
2350,ICICI BANK LIMITED,ICIC0002485,DIGHA PATNA,ICICI BANK LTD 1570 DIGHA GHAT NEAR AKHAND JYOTI HOSPITAL PATNA,PATNA,DIGHA,BIHAR,7783802902
2351,ICICI BANK LIMITED,ICIC0002486,GAYA TEKARI ROAD,"1ST FLR HARI OM COMPLEX MIR SHAFAYAT ROAD,PURANI GOADAM GAYA 823001",GAYA,GAYA,BIHAR,6313200220
2352,ICICI BANK LIMITED,ICIC0002487,PALLIMUKKU,"ICICI BANK LTD., RR TOWERS, VADAKKEVILA. P.O, VENDARMUKKU JN, PALLIMUKKU JN, KOLLAM - 691010, KERALA",KOLLAM,PALLIMUKKU,KERALA,0
2353,ICICI BANK LIMITED,ICIC0002488,MANKAVU,ICICI BANK LTD GROUND FLOOR CHOICE ARCADE BYPASS MANKAV DIST KOZHIKODE 673007 KERALA,KOZHIKODE,MANKAVU,KERALA,9746745601
2354,ICICI BANK LIMITED,ICIC0002489,KARAPARAMBA,ICICI BANK LTD GROUND FLOOR ACE AVENUE CANAL ROAD KARAPARAMBA P.O KOZHIKODE 673 010 KERALA,KOZHIKODE,CALICUT,KERALA,9567261583
2355,ICICI BANK LIMITED,ICIC0002490,AREEKKAD,"ICICI BANK LTD., AR COMPLEX, AREEKKAD JUNCTION, KOZHIKODE - 673027, KERALA",KOZHIKODE,CALICUT,KERALA,0
2356,ICICI BANK LIMITED,ICIC0002491,KUKATPALLY,"ICICI BANK LTD., PLOT NO. 545 , KPHB PHASE VI, KUKATPALLY - 500085,┬áRANGAREDDY DIST., ANDHRA PRADESH ┬á",RANGAREDDY,KUKATPALLY,ANDHRA PRADESH,0
2357,ICICI BANK LIMITED,ICIC0002492,KULT,BTNWRGRTBNYMCBWWTB,BARDDHAMAN,KULTI,WEST BENGAL,8584856660
2358,ICICI BANK LIMITED,ICIC0002493,KURUKSHETRA,"ICICI BANK LTD., PIPLI ROAD, KURUKSHETRA - 136118, HARYANA ┬á",KURUKSHETRA,KURUKSHETRA,HARYANA,0
2359,ICICI BANK LIMITED,ICIC0002494,SEETHAMMADHARA-VISAKHAPATNAM,"ICICI BANK LTD, NO 53 32 5 17, UPPER GROUND KRM COLONY, MAIN ROAD SEETHAMMADHARA VSKP 530013.",VISHAKHAPATNAM,VISAKHAPATNAM,ANDHRA PRADESH,7032953465
2360,ICICI BANK LIMITED,ICIC0002495,AZADNAGAR BRANCH,ICICI BANK LTD AZADNAGAR BRANCH AZADNAGAR MANGO NEAR CHEPAPUL,PURBI SINGHBHUM,JAMSHEDPUR,JHARKHAND,0
2361,ICICI BANK LIMITED,ICIC0002496,MALERKOTLA,"ICICI BANK LTD, NEAR BDPO OFFICE, COLLEGE ROAD, MALERKOTLA - 148023,PUNJAB",SANGRUR,SANGRUR,PUNJAB,0
2362,ICICI BANK LIMITED,ICIC0002497,MIRA ROAD-SECTOR11,"ICICI BANK LTD., SHOP NO. 10,11,12 & 03, BUILDING NO 23,24 & 25, AKSHAR SAGAR CHS, SECTOR NO. 11,┬á SHANTI NAGAR, MIRA ROAD (E), THANE - 401 107.",GREATER BOMBAY,MUMBAI,MAHARASHTRA,0
2363,ICICI BANK LIMITED,ICIC0002498,NATIONAL 8A,"ICICI BANK LTD., SHAKTI CHAMBER 1, NATIONAL 8A, MORVI - 363642, GUJARAT",RAJKOT,MORVI,GUJARAT,0
2364,ICICI BANK LIMITED,ICIC0002499,NABADWIP,BARALGHAT ARATGHAT ROAD NABADWIP PIN 741302,NADIA,NABADWIP,WEST BENGAL,8584010979
2365,ICICI BANK LIMITED,ICIC0002500,STATION RD NADIAD,ICICI BANK LTD OMKAR OM ELEGANCE FIRST FLOOR NEAR PATEL ROAD PIJ ROAD NADIAD GUJARAT,KHEDA,NADIAD,GUJARAT,9998745011
2366,ICICI BANK LIMITED,ICIC0002501,VETTURNIMADAM NAGERCOIL,ICICI BANK LTD.JEYAJOTHI BUILDING NEAR PKC COLLEGE VETTURNIMADAM NAGERCOIL 629003 TAMILNADU,KANYAKUMARI,NAGERCOIL,TAMIL NADU,9840343787
2367,ICICI BANK LIMITED,ICIC0002502,NAIHATI,ICICI BANK LTD 56 R.B.C.ROAD NAIHATI NORTH 24 PARGANAS WEST BENGAL 743165,NORTH 24 PARGANAS,NAIHATI,WEST BENGAL,8420117398
2368,ICICI BANK LIMITED,ICIC0002503,NELLORE VEDAYAPALEM,ICICI BANK LTD DNO 25 - 2 - 480-1 SAVITREE NAGAR VEDAYAPALEM NELLORE - 524004,NELLORE,NELLORE,ANDHRA PRADESH,7702325522
2369,ICICI BANK LIMITED,ICIC0002504,SECTOR 48,"ICICI BANK LTD., SECTOR-48, NOIDA -201301, UTTAR PRADESH",GAUTAM BUDDHA NAGAR,NOIDA,UTTAR PRADESH,0
2370,ICICI BANK LIMITED,ICIC0002505,SECTOR 41,ICICI BANK LTD PLOT NO 1 B 127 SECTOR 41 NOIDA UTTAR PRADESH 201303,GAUTAM BUDDHA NAGAR,NOIDA,UTTAR PRADESH,7042190618
2371,ICICI BANK LIMITED,ICIC0002506,NOIDA SEC,ICICI BANK LTD HALL N.O-36 G-BLOCK GAUR GRANDEUR PLOT N.O-GH-04 SECTOR-119 NOIDA - 201305,GAUTAM BUDDHA NAGAR,NOIDA,UTTAR PRADESH,8826693059
2372,ICICI BANK LIMITED,ICIC0002507,SUTAPATTI BRANCH,"HARIVILASH LANE,ISHLAMPUR ROAD,MUZAFFARPUR-842001 BIHAR",MUZAFFARPUR,MUZAFFARPUR,BIHAR,0
2373,ICICI BANK LIMITED,ICIC0002508,ORAI,ICICI BANK LTD 83 SUBHASH NAGAR RAJMARG ORAI DISTT JALAUN STATE UP PINCODE 285001,JALAUN,ORAI,UTTAR PRADESH,7860897869
2374,ICICI BANK LIMITED,ICIC0002509,VICTORIA COLLEGE,ICICI BANK LTD MIDHUN ARCADE VICTORIA COLLEGE JUNCTION PALAKKAD 678001,PALAKKAD,PALAKKAD,KERALA,9567675757
2375,ICICI BANK LIMITED,ICIC0002510,PAMMAL,"ICICI BANK LTD., NO. 40, PAMMAL MAIN ROAD, PAMMAL - 600 075, CHENNAI,TAMIL NADU",CHENNAI,CHENNAI,TAMIL NADU,0
2376,ICICI BANK LIMITED,ICIC0002511,"SECTOR 2, PANCHKULA","ICICI BANK LTD., SCF 5, SECTOR 2, URBAN ESTATE, PANCHKULA - 134112, HARYANA",PANCHKULA,PANCHKULA,HARYANA,0
2377,ICICI BANK LIMITED,ICIC0002512,PANIPAT SECTOR 11,SCF 48 SECTOR 11 HUDA SHOPPING COMPLEX.PANIPAT,PANIPAT,PANIPAT,HARYANA,9991682548
2378,ICICI BANK LIMITED,ICIC0002513,DLF COLONY,"ICICI BANK LTD., S 9-10, DLF COLONY, SIRHIND ROAD, PATIALA -147001, PUNJAB",PATIALA,PATIALA,PUNJAB,0
2379,ICICI BANK LIMITED,ICIC0002514,RANCHI,ICICI BANK LTD PHOOL DEEP TOWER BESIDE SIRD OFFICE PO HEHAL NH-75 RATU ROAD PISKA MORE RANCHI 834005,RANCHI,RANCHI,JHARKHAND,0
2380,ICICI BANK LIMITED,ICIC0002515,Raipur - Shankar Nagar,"ICICI Bank Ltd, Jeevan Apartment, Main Road, Shankar Nagar Chowk, Raipur Chattisgarh 492001",RAIPUR,RAIPUR,CHANDIGARH,0
2381,ICICI BANK LIMITED,ICIC0002516,Raipur - Tatiband,"ICICI Bank Ltd, R Eminence , Shop No. 1,25,26,27,28 G E Road Tatibandh, Raipur Chhattisgarh 492099",RAIPUR,TATIBANDH,CHANDIGARH,0
2382,ICICI BANK LIMITED,ICIC0002517,RAJPUR SONARPUR,ICICI BANK LTD.SONARPUR K RAY CHOWDHURY SARANI SAHEBPARA OPP POWER HOUSE KOLKATA 700150,SOUTH 24 PARGANAS,RAJPUR SONARPUR,WEST BENGAL,8584849283
2383,ICICI BANK LIMITED,ICIC0002518,FATUHA,ICICI BANK LTD PLOT NO -526 STATION ROAD FATUHA PATNA-803201,PATNA,FATWAH,BIHAR,0
2384,ICICI BANK LIMITED,ICIC0002519,MORABADI,"ICICI BANK LTD., PARK PLAZA,TAIGORE HILL ROAD, MORBADI,┬áRANCHI - 834008, JHARKHAND ┬á",RANCHI,RANCHI,JHARKHAND,0
2385,ICICI BANK LIMITED,ICIC0002520,RANCHI HARMU ROAD,ICICI BANK LTD.KISHORGANJ HARMU ROAD NEAR SHIVAJEE CHOWK RANCHI 834001 JHARKHAND,RANCHI,RANCHI,JHARKHAND,7544002686
2386,ICICI BANK LIMITED,ICIC0002521,KOELNAGAR BRANCH,ICICI BANK LTD C BY 26 KOELNAGR ROURKELA 769014,SUNDARGARH,RAURKELA,ODISHA,7894470940
2387,ICICI BANK LIMITED,ICIC0002522,ROHTAK,"ICICI BANK LTD.,F-236, MODEL TOWN, DELHI ROAD, ROHTAK - 124001, HARYANA ┬á",ROHTAK,ROHTAK,HARYANA,0
2388,ICICI BANK LIMITED,ICIC0002523,NAYAPADA,"ICICI BANK LTD., QUALITY MANSION, NAYAPADA, SAMBALPUR - 768001, ORISSA",SAMBALPUR,SAMBALPUR,ODISHA,0
2389,ICICI BANK LIMITED,ICIC0002524,SILCHAR UKD ROAD,ICICI BANK LTD.SILCHAR BRANCH 2 ULLASKAR DUTTA SARANI SHILLONGPATTY SILCHAR 788001,CACHAR,SILCHAR,ASSAM,9435172853
2390,ICICI BANK LIMITED,ICIC0002525,SOLAPUR,"ICICI BANK LTD., H. NO.972/73, FATTEPURKAR COMPLEX, S. NO.1816/A, NORTH KASBA, SOLAPUR - 413007, MAHARASHRA",SOLAPUR,SOLAPUR,MAHARASHTRA,0
2391,ICICI BANK LIMITED,ICIC0002526,SECTOR 15 SONEPAT,ICICI BANK LTD SCO 156 SECTOR 15 SONIPAT HARYANA,SONIPAT,SONIPAT,HARYANA,9729549668
2392,ICICI BANK LIMITED,ICIC0002527,KARANNAGAR SRINAGAR,CICI BANK LTD.MAIN ROAD NEAR GOLE MARKET KARAN NAGAR SRINAGAR 190010 JAMMU KASHMIR,SRINAGAR,KARANNAGAR,JAMMU AND KASHMIR,9596781390
2393,ICICI BANK LIMITED,ICIC0002528,IG ROAD SRINAGAR,AKSA MALL IG ROAD SRINAGAR 190001,SRINAGAR,SRINAGAR,JAMMU AND KASHMIR,9906663644
2394,ICICI BANK LIMITED,ICIC0002529,BOHRI KADAL SRINAGAR,ICICI BANK LTD NALLAMAR ROAD BOHRI KADAL CHOWK SRINAGAR,SRINAGAR,SRINAGAR,JAMMU AND KASHMIR,8491942430
2395,ICICI BANK LIMITED,ICIC0002530,TADEPALLIGUDEM,"ICICI BANK LTD., AMRUTHA HOSPITALS, K N ROAD, TADEPALLIGUDAM- 534101, WEST GODAVARI DIST., ANDHRA PRADESH",WEST GODAVARI,TADEPALLIGUDEM,ANDHRA PRADESH,0
2396,ICICI BANK LIMITED,ICIC0002531,TENALI,"ICICI BANK LTD., GOPALA REDDY STREET , GANGANAMMAPETA,┬á TENALI - 522201, GUNTUR DIST., ANDHRA PRADESH",GUNTUR,TENALI,ANDHRA PRADESH,0
2397,ICICI BANK LIMITED,ICIC0002533,TIRUMALA,"ICICI BANK LTD., KRISHNA SHYAMA, TIRUMALA, THIRUVANTHAPURAM ┬û 695561, KERALA",THIRUVANANTHAPURAM,THIRUVANANTHAPURAM,KERALA,0
2398,ICICI BANK LIMITED,ICIC0002534,TRIVANDRUM-TECHNOPARK,ICICI BANK LTD GROUND FLOOR PADMANABHAM BUILDING TECHNOPARK TRIVANDRUM 695581,THIRUVANANTHAPURAM,THIRUVANANTHAPURAM,KERALA,0
2399,ICICI BANK LIMITED,ICIC0002535,THRISSUR EAST FORT,ICICI BANK THRISSUR EAST FORT BRANCH KING COURT BISHOP PALACE ROAD EAST FORT THRISSUR 680005,THRISSUR,THRISSUR,KERALA,8129601197
2400,ICICI BANK LIMITED,ICIC0002536,MAHARAJA NAGAR,"ICICI BANK LTD., B.24/3, 26TH CROSS STREET, MAHARAJA NAGAR, TIRUNELVELI -627011, TAMIL NADU",TIRUNELVALI,TIRUNELVELI,TAMIL NADU,0
2401,ICICI BANK LIMITED,ICIC0002537,TIRUPATI- AIR BYPASS RAOD,ICICI BANK LTD  PLOT NO 156  NEW BALAJI COLONY  AIR BYPASS ROAD TIRUPATHI 517502,CHITTOOR,CHITTOOR,ANDHRA PRADESH,0
2402,ICICI BANK LIMITED,ICIC0002538,PN ROAD TIRUPPUR,ICICI BANK LTD 17 SAKTHI NAGAR PN ROAD TIRUPUR 641602 TAMILNADU,TIRUPUR,TIRUPUR,TAMIL NADU,9750053253
2403,ICICI BANK LIMITED,ICIC0002539,THIRUVOTTIYUR,"ICICI BANK LTD.,23&24, T.H.ROAD THANGAL.THIRUVOTTIYUR CHENNAI-781019",CHENNAI,CHENNAI,TAMIL NADU,0
2404,ICICI BANK LIMITED,ICIC0002540,KURINJI NAGAR BRANCH,NO.160N BY 26F BY 5 JOHN COMPLEX KURINJI NAGAR POLEPETTAI TUTICORIN 628 002,THOOTHUKUDI,TUTICORIN,TAMIL NADU,9884706807
2405,ICICI BANK LIMITED,ICIC0002541,DIVINE VALLEY,"ICICI BANK LTD., BLOCK A, DIVINE VALLEY, A-1, DEWAS ROAD,┬áUJJAIN - 456010, MADHYA PRADESH",UJJAIN,UJJAIN,MADHYA PRADESH,0
2406,ICICI BANK LIMITED,ICIC0002542,ULUBERIA,BAZARPARA WARD NO 7 PO PS ULUBERIA PIN 711316,HAORA,ULUBERIA,WEST BENGAL,8584856667
2407,ICICI BANK LIMITED,ICIC0002543,YAMUNA NAGAR BYE PASS CHOWK,ICICI BANK LTD.1116-4 BYPASS CHOWK JAGADHARI ROAD YAMUNA NAGAR HARYANA -135001,YAMUNANAGAR,YAMUNANAGAR,HARYANA,9996312500
2408,ICICI BANK LIMITED,ICIC0002544,AFZALPUR HAVALGA,ICICI BANK LTD SHOPPING COMPLEX SRI RENUKA SUGARS LTD DIVISION 5 HAVALGA 585301,GULBARGA,AFZALPUR,KARNATAKA,9886427166
2409,ICICI BANK LIMITED,ICIC0002545,AKHNOOR,ICICI BANK LTD STATION HEADQUARTER AKHNOOR MILITARY STATION AKHNOOR JAMMU 181201,JAMMU,AKHNOOR,JAMMU AND KASHMIR,9596756188
2410,ICICI BANK LIMITED,ICIC0002546,ARARIA,"ICICI BANK LTD., RAHIKA TOLA, MAHAVIR NAGAR ROAD, MARHARI PATTI, ARARIA - 854311, BIHAR",ARARIA,ARARIA,BIHAR,0
2411,ICICI BANK LIMITED,ICIC0002547,AURAIYA,ICICI BANK LTD 26 BY 1281 MOHALLA BADANPUR CITY AURAIYA DISTRICT AURAIYA U.P.206122,AURAIYA,AURAIYA,UTTAR PRADESH,7525011628
2412,ICICI BANK LIMITED,ICIC0002548,BUDGAM,ICICI BANK LTD A.S.H MALL TOWN HALL ROAD BUDGAM JAMMU AND KASHMIR 191111,BUDGAM,BUDGAM,JAMMU AND KASHMIR,8491942413
2413,ICICI BANK LIMITED,ICIC0002549,BADNAGAR,"ICICI BANK LTD., 26, MAHARANA PRATAP CHOWK, BADNAGAR ┬û 456771, MADHYA PRADESH ┬á",UJJAIN,BARNAGAR,MADHYA PRADESH,0
2414,ICICI BANK LIMITED,ICIC0002550,BAGDOGRA,"ICICI BANK LTD., BAGDOGRA GURUDWARA, NH 31, PO. BAGDOGRA ┬û 734014, DIST. DARJEELING, WEST BENGAL",DARJILING,BAGDOGRA,WEST BENGAL,0
2415,ICICI BANK LIMITED,ICIC0002551,BALODA BAZAR,"ICICI BANK LTD., AMBEDKER CHOWK, BHATAPARA MAIN ROAD, BALODA BAZAR - 494341, CHHATTISGARH",RAIPUR,BHATAPARA,CHANDIGARH,0
2416,ICICI BANK LIMITED,ICIC0002552,BALUGAON,"ICICI BANK LTD., MAIN ROAD, NH-5, BALUGOAN-752030, DIST. KHURDA, ORISSA ┬á",KHURDA,BALUGAON,ODISHA,0
2417,ICICI BANK LIMITED,ICIC0002554,BANKRA,"ICICI BANK LTD., VILLAGE & PO: BANKRA, KABARPARA, PS: DOMJUR, HOWRAH DIST.,┬áPIN CODE - 711403, WEST BENGAL",BANKURA,BANKURA,WEST BENGAL,0
2418,ICICI BANK LIMITED,ICIC0002556,BARAUNI,"ICICI BANK LTD., MIRCHAIYA CHOWK, RAJENDRA ROAD, BARAUNI - 851112, BEGUSARAI DIST., BIHAR",BEGUSARAI,BARAUNI,BIHAR,0
2419,ICICI BANK LIMITED,ICIC0002557,BARI BRAHAMNA,"ICICI BANK LTD., C/O JAI MATA SHUTTERING SUPPLIERS, NH-1, BARI BRAHMNA - 181133, DIST.SAMBHA, JAMMU & KASHMIR ┬á",SAMBA,SAMBA,JAMMU AND KASHMIR,0
2420,ICICI BANK LIMITED,ICIC0002558,BHABUA,KUBER COMPLEX OPP JAGJIVAN STADIUM PO BHABUA BIHAR PIN 821101,KAIMUR,BHABUA,BIHAR,7781006234
2421,ICICI BANK LIMITED,ICIC0002559,BHADERWAH,"ICICI BANK LTD., OPPOSITE BSNL TELEPHONE EXCHANGE, LINK ROAD, BHADERWAH -182222,┬áDODA DIST., JAMMU & KASHMIR ┬á",DODA,BHADERWAH,JAMMU AND KASHMIR,0
2422,ICICI BANK LIMITED,ICIC0002560,BODH GAYA,"ICICI BANK LTD., HOTEL THE TAJ INN, MAIN ROAD, BODH GAYA - 824231, BIHAR",GAYA,GAYA,BIHAR,0
2423,ICICI BANK LIMITED,ICIC0002561,CANNING,OPP HP PETROL PUMP PAL VILLA CANNING MAIN ROAD CANNING,SOUTH 24 PARGANAS,CANNING,WEST BENGAL,9903587032
2424,ICICI BANK LIMITED,ICIC0002562,CHAKDAHA,"ICICI BANK LTD., CHAKDAH BONGAON ROAD, LALPUR, CHAKDAHA ┬û 741222,┬áNADIA DIST., WEST BENGAL",NADIA,CHAKDAH,WEST BENGAL,0
2425,ICICI BANK LIMITED,ICIC0002563,SHEOHAR,"SUKRIT COMPLEX,NEAR COLLECTORIATE GATE,WARD NO.15,SHEOHAR",SHEOHAR,SHEOHAR,BIHAR,9835606070
2426,ICICI BANK LIMITED,ICIC0002564,CONTAI,"ICICI BANK LTD., CONTAI DHANDHIGI, PO: CONTAI - 721401, WARD NO. 14, PURBA MEDINIPUR DIST., WEST BENGAL",PURBA MEDINIPUR,CONTAI,WEST BENGAL,0
2427,ICICI BANK LIMITED,ICIC0002565,CHHENDIPADA,"ICICI BANK LTD., MAIN ROAD, CHHENDIPADA, ANGUL - 759124, ORISSA",ANGUL,CHHENDIPADA,ODISHA,0
2428,ICICI BANK LIMITED,ICIC0002566,DIBIYAPUR,"ICICI BANK LTD., KHASRA NO 407 , OPPOSITE GAIL GAON,┬áVILLAGE : BAISHUNDHARA , DIBIYAPUR - 206244, AURAIYA DIST., UTTAR PRADESH",AURAIYA,DIBIYAPUR,UTTAR PRADESH,0
2429,ICICI BANK LIMITED,ICIC0002567,CHUMUKEDIMA,"ICICI BANK LTD., N.H - 29, WARD NO. 4, 7TH MILE, NEAR CHAKESANG BAPTIST CHURCH, CHUMUKEDIMA, DIMAPUR - 797103, NAGALAND",DIMAPUR,CHUMUKEDIMA,NAGALAND,0
2430,ICICI BANK LIMITED,ICIC0002568,DODA,"ICICI BANK LTD., NEAR DAK BANGLA, DODA - 182202, JAMMU & KASHMIR",DODA,DODA,JAMMU AND KASHMIR,0
2431,ICICI BANK LIMITED,ICIC0002569,ROSERA,CHANDRASHEKHAR COMPLEX WARD NO-10 NEAR SANSKRIT HIGH SCHOOL KATHERBANNI ROSRA-848210,SAMASTIPUR,ROSERA,BIHAR,9771465245
2432,ICICI BANK LIMITED,ICIC0002570,DUTTAPUKUR,"ICICI BANK LTD., JESSORE ROAD, DUTTAPUKUR STATION ROAD MORE, HATKHOLA DUTTAPUKUR, PO. DUTTAPUKUR-743248, DIST. NORTH 24 PARGANAS,┬áWEST BENGAL",NORTH 24 PARGANAS,DUTTAPUKUR,WEST BENGAL,0
2433,ICICI BANK LIMITED,ICIC0002571,GADARWARA,"ICICI BANK LTD.,┬á OPPOSITE GOVT. HOSPITAL, STATION ROAD, GADARWARA ┬û 487551, NARSINGHPUR DIST., MADHYA PRADESH",NARSIMHAPUR,GADARWARA,MADHYA PRADESH,0
2434,ICICI BANK LIMITED,ICIC0002572,JAMTARA,"ICICI BANK LTD., NEW TOWN, NEAR CHILDREN PARK , JAMTARA - 815351, JHARKHAND",JAMTARA,JAMTARA,JHARKHAND,0
2435,ICICI BANK LIMITED,ICIC0002573,JEHANABAD,"ICICI BANK LTD., BUDH LEELA MARKET, BUILDING NO. 771, JEHANABAD - 804408, BIHAR",JEHANABAD,JEHANABAD,BIHAR,0
2436,ICICI BANK LIMITED,ICIC0002574,JUGSALAI,"ICICI BANK LTD.,┬á STATION ROAD, JUGSALAI - 831002, JAMSHEDPUR, DIST. EAST SINGHBHUM, JHARKHAND",PURBI SINGHBHUM,JAMSHEDPUR,JHARKHAND,0
2437,ICICI BANK LIMITED,ICIC0002575,HAFLONG,ICICI BANK LTD WAIMIZING BUILDING NEAR POLICE STATION HAFLONG DIMA HASAO ASSAM-788819,NORTH CACHAR HILLS,HAFLONG,ASSAM,0
2438,ICICI BANK LIMITED,ICIC0002576,KARGIL,ICICI BANK LTD MAIN MARKET NEAR TIBETAN MARKET KARGIL JAMMU AND KASHMIR -194103,KARGIL,KARGIL,JAMMU AND KASHMIR,10
2439,ICICI BANK LIMITED,ICIC0002577,KHATEGAON,"ICICI BANK LTD., INDORE DEWAS ROAD, OPPOSITE BPCL PETROL PUMP, NEAR MANDI, KHATEGAON - 455336, DIST. DEWAS, MADHYA PRADESH",DEWAS,KHATEGAON,MADHYA PRADESH,0
2440,ICICI BANK LIMITED,ICIC0002578,KOHIMA - NH 39,"ICICI BANK LTD., IOC PETROL PUMP, OPP. BAPTIST CHURCH, NH 39, KOHIMA - 797001, NAGALAND",KOHIMA,KOHIMA,NAGALAND,0
2441,ICICI BANK LIMITED,ICIC0002579,KOLENCHERRY,"ICICI BANK LTD, KOLENCHERY BRANCH, PALLIMUKALEL BUILDING, COLLEGE JN. ,NEAR ST PETERS COLLEGE, KOLENCHERY P O ,ERNAKULAM-682311",ERNAKULAM,KOLENCHERRY,KERALA,0
2442,ICICI BANK LIMITED,ICIC0002580,KONNAGAR,B353ROMESEEKSHLY,HUGLI,KONNAGAR,WEST BENGAL,8584826537
2443,ICICI BANK LIMITED,ICIC0002581,KORAPUT,"ICICI BANK LTD., NH-26, MAIN ROAD, P.S. KORAPUT, KORAPUT -764020, ORISSA ┬á",KORAPUT,KORAPUT,ODISHA,0
2444,ICICI BANK LIMITED,ICIC0002582,KUNDARA,"ICICI BANK LTD., HOSPITAL JUNCTION, KUNDARA - 691501, KOLLAM DIST., KERALA",KOLLAM,KUNDARA,KERALA,0
2445,ICICI BANK LIMITED,ICIC0002583,LAMPHELPAT,"ICICI BANK LTD., LAMPHELPAT, URIPOK YAMBEM LEIKAI, IMPHAL WEST, PIN-795004, MANIPUR",IMPHAL,IMPHAL,MANIPUR,0
2446,ICICI BANK LIMITED,ICIC0002584,MAIN BRANCH MADHEPURA,ICICI BANK LTD MAIN ROAD NEAR SNPM HIGH SCHOOL MADHEPURA 852113 BIHAR,MADHEPURA,MADHEPURA,BIHAR,9934781455
2447,ICICI BANK LIMITED,ICIC0002585,MALLAPPALLY,ICICI BANK LTD MUTHUTHODATHU MALLAPPALLY WEST PO MALLAPPLLY KERALA 689585,PATHANAMTHITTA,MALLAPPALLY,KERALA,8289908752
2448,ICICI BANK LIMITED,ICIC0002586,MANNAR,XVII 273 PANAMTHARA MAMPALLIL HOUSE STORE JUNCTION MANNAR ALAPPUZHA DIST KERALA PIN 689622,ALAPUZHA,MANNAR,KERALA,9446938862
2449,ICICI BANK LIMITED,ICIC0002587,DULER-MAPUSA,SUNSET BOULEVARD SHOP NO AG-9& AG-10 GROUND FLOOR DULER MAPUSA 403507,NORTH GOA,MAPUSA,GOA,9970499449
2450,ICICI BANK LIMITED,ICIC0002588,MORIGAON,"ICICI BANK LTD., OPP. DAILY MARKET, MORIGAON TOWN, WARD NO. 5, MORIGAON - 782105, ASSAM ┬á",MORIGAON,MORIGAON,ASSAM,0
2451,ICICI BANK LIMITED,ICIC0002589,BENAULIM,ICICI BANK LTD.953 BY GFS 2 3 4 AND 953 BY GFG 5 OLLEMBHAT VOLTAR ACSONA BENAULIM SALCETE GOA,MARGAO,BENAULIM,GOA,9890642702
2452,ICICI BANK LIMITED,ICIC0002590,MUGHALSARAI,"ICICI BANK LTD., 417/1, BHAGYA VILLA, OPP. AGARWAL PETROL PUMP,┬áG.T. ROAD, NAI BASTI, MUGHALSARAI-232101, DIST. CHANDAULI, UTTAR PRADESH ┬á",CHANDAULI,MUGHALSARAI,UTTAR PRADESH,0
2453,ICICI BANK LIMITED,ICIC0002591,MULTAI,"ICICI BANK LTD., RAILWAY STATION ROAD, PATEL WARD NO. 2, MULTAI - 460661,┬áBETUL DIST., MADHYA PRADESH",BETUL,MULTAI,MADHYA PRADESH,0
2454,ICICI BANK LIMITED,ICIC0002592,JAYANAGAR,"ICICI BANK LTD,JAYANAGAR BRANCH,BORMOTORIA,BELTOLA BAZAR ROAD GUWAHATI-781028",KAMRUP METROPOLITAN,GUWAHATI,ASSAM,8811072037
2455,ICICI BANK LIMITED,ICIC0002593,NAHARLAGUN,BASAR COMMERCIAL CENTER D SECTOR BARAPANI BAZAR NAHARLAGUN ARUNACHAL PRADESH 791110,PAPUMPARE,NAHARLAGUN,ARUNACHAL PRADESH,9957571905
2456,ICICI BANK LIMITED,ICIC0002594,NAUGACHIA,ICICI BANK LTD IN FRONT OF LIC OFFICE NEAR BAM KALI MANDIR NAUGACHIA 853204 DIST BHAGALPUR BIHAR,BHAGALPUR,NAUGACHIA,BIHAR,7541807097
2457,ICICI BANK LIMITED,ICIC0002595,NORTH GUWAHATI SUALKUCHI BRANCH,ICICI BANK LTD OPP SANKAR DEV DHAM PO AND PS SOALKUCHI DIST KAMRUP ASSAM 781103,KAMRUP,KAMRUP,ASSAM,8011015409
2458,ICICI BANK LIMITED,ICIC0002596,"PAMPORE, JAMMU & KASHMIR","ICICI BANK LTD., G.M COMPLEX, NH-1, KADALBAL PAMPORE - 192121,┬áPULWAMA DIST., JAMMU & KASHMIR ┬á",PULWAMA,PAMPORE,JAMMU AND KASHMIR,0
2459,ICICI BANK LIMITED,ICIC0002597,PANNA,"ICICI BANK LTD., NEAR GOVIND SQUARE, KISHORE GANJ, PANNA - 488001,┬áMADHYA PRADESH",PANNA,PANNA,MADHYA PRADESH,0
2460,ICICI BANK LIMITED,ICIC0002598,BAPUJI NAGAR,PLOT NO 664 UNIT I BAPUJI NAGAR BHUBANESWAR 751009,KHORDHA,BHUBANESWAR,ODISHA,0
2461,ICICI BANK LIMITED,ICIC0002599,PARLI VAIJNATH,"ICICI BANK LTD.,┬áCST NO. 689, PLOT NO. 31, PREMPRADNYA NAGAR, PARLI VAIJNATH - 431515, DIST. BID., MAHARASHTRA",BID,PARLI-VAIJNATH,MAHARASHTRA,0
2462,ICICI BANK LIMITED,ICIC0002600,PONNANI,"ICICI BANK LTD., MIYA TOWERS, CV JUNCTION, PONNANI - 679577, MALAPPURAM DIST., KERALA",MALAPPURAM,PONNANI,KERALA,0
2463,ICICI BANK LIMITED,ICIC0002601,PULWAMA,ICICI BANK LTD SANA COMPLEX COURT ROAD PULWAMA -192301,PULWAMA,PULWAMA,JAMMU AND KASHMIR,9086999961
2464,ICICI BANK LIMITED,ICIC0002602,RAJOURI,ICICI BANK LTD WARD NO 4 NEAR SALANI BRIDGE NEW BUS STAND RAJOURI,RAJOURI,RAJOURI,JAMMU AND KASHMIR,8493834216
2465,ICICI BANK LIMITED,ICIC0002603,SANQUELIM,"ICICI BANK LTD., CARAPUR TISK, SANQUELIM-BICHOLIM, GOA - 403505",NORTH GOA,SANQUELIM,GOA,0
2466,ICICI BANK LIMITED,ICIC0002604,GAMBHARIA,"ICICI BANK LTD., MEGHRAJ TOWER, MAIN ROAD, GAMBHARIA - 832108, DIST. SARAIKELA KHARSAWA, JHARKHAND",SARAIKELA-KHARSAWAN,KHARSAWAN,JHARKHAND,0
2467,ICICI BANK LIMITED,ICIC0002605,KHUNTI,ICICI BANK LTD SHYAM COMPLEX BHAGAT SINGH CHOWK MAIN ROAD KHUNTI JHARKHAND 835210,KHUNTI,KHUNTI,JHARKHAND,9771418915
2468,ICICI BANK LIMITED,ICIC0002606,SOPORE JK,SAMADS MALL DOWN TOWN SOPORE J AND K-193201,BARAMULLA,SOPORE,JAMMU AND KASHMIR,8491942450
2469,ICICI BANK LIMITED,ICIC0002607,SULTANGANJ,"ICICI BANK LTD., NO.1, UPPER ROAD, MAHAJAN TOLA, SULTANGANJ - 813213, BHAGALPUR DIST., BIHAR",BHAGALPUR,SULTANGANJ,BIHAR,0
2470,ICICI BANK LIMITED,ICIC0002608,SUPAUL,"ICICI BANK LTD., VINAYAK COMPLEX, NAUANNA, KACHARY ROAD,┬áSUPAUL- 852131,┬áBIHAR",SUPAUL,SUPAUL,BIHAR,0
2471,ICICI BANK LIMITED,ICIC0002609,TARAKESHWAR,ICICI BANK LTD  SAHAPUR CHAWALPUTTI TARAKESWAR HOOGHLY PIN-712410  WEST BENGAL,HUGLI,TARAKESWAR,WEST BENGAL,8658027338
2472,ICICI BANK LIMITED,ICIC0002610,UDALGURI,"ICICI BANK LTD., UDALGURI, WARD NO-2, OPPOSITE POLICE STATION, UDALGURI - ROWTA ROAD, UDALGURI ┬û 784509, ASSAM ┬á",DARRANG,UDALGURI,ASSAM,0
2473,ICICI BANK LIMITED,ICIC0002611,UMARIA,"ICICI BANK LTD., NEAR OLD BUS STAND, STATION ROAD, UMARIA - 484555, MADHYA PRADESH",UMARIA,UMARIA,MADHYA PRADESH,0
2474,ICICI BANK LIMITED,ICIC0002612,USGAON,BNNRNRHHUBURUNN403406,NORTH GOA,USGAON,GOA,7757020451
2475,ICICI BANK LIMITED,ICIC0002613,VALSAD - ABRAMA,"ICICI BANK LTD., RANCHODJI NAGAR, DHARAMPUR ROAD, ABRAMA, VALSAD - 396001, GUJARAT",VALSAD,DHARAMPUR,GUJARAT,0
2476,ICICI BANK LIMITED,ICIC0002614,SHAPAR - VERAVAL,"ICICI BANK LTD., VINUS INDUSTRIAL PARK , SURVEY NO. 205, VERAVAL TOAD, SHAPAR - VERAVAL ┬û 360025, RAJKOT DIST., GUJARAT",RAJKOT,RAJKOT,GUJARAT,0
2477,ICICI BANK LIMITED,ICIC0002615,WADAKANCHERRY,"ICICI BANK LTD., ARYA TOWER, MAIN ROAD, WADAKANCHERRY - 680582, TRICHUR, KERALA ┬á",THRISSUR,WADAKANCHERRY,KERALA,0
2478,ICICI BANK LIMITED,ICIC0002616,MANDREM,"ICICI BANK LTD., H. NO.130, MADHALAMAZ, MANDREM - 403527,GOA.",NORTH GOA,MANDREM,GOA,0
2479,ICICI BANK LIMITED,ICIC0002617,AMBASSA,"ICICI BANK LTD., ASSAM AGARTALA ROAD, NEAR CMO OFFICE, VILLAGE- NATUN PALLI, PO. AMBASSA - 794289, DHALAI DIST., TRIPURA",DHALAI,AMBASSA,TRIPURA,0
2480,ICICI BANK LIMITED,ICIC0002618,BAGNAN,ICICI BANK LTD O T ROAD NEAR SUJATA CINEMA BAGNAN HOWRAH 711303 WEST BENGAL,HAORA,HOWRAH,WEST BENGAL,9438068768
2481,ICICI BANK LIMITED,ICIC0002619,BIJBEHARA,ICICI BANK LTD GATTO COMPLEX MAIN MARKET BIJBEHARA DIST ANANTNAG.JAMMU AND KASHMIR 192124,ANANTNAG,BIJBEHARA,JAMMU AND KASHMIR,9596781380
2482,ICICI BANK LIMITED,ICIC0002620,SUJANPUR,ICICI BANK LTD OPP POST OFFICE SUJANPUR 145001,PATHANKOT,SUJANPUR,PUNJAB,8288092723
2483,ICICI BANK LIMITED,ICIC0002621,MAYNAGURI BRANCH,ICICI BANK LTD DEBINAGAR MILPARA JALPAIGURI MAIN ROAD MAYNAGURI JALPAIGURI WEST BENGAL 735224,JALPAIGURI,MAINAGURI,WEST BENGAL,8584874847
2484,ICICI BANK LIMITED,ICIC0002622,BOMDILA,ICICI BANK LTD BOMDILA PLOT NO 149 HILL TOP NEAR CO OPERATIVE BUILDING DIST WEST KAMENG 790001,WEST KAMENG,BOMDILA,ARUNACHAL PRADESH,9854028641
2485,ICICI BANK LIMITED,ICIC0002623,BURNIHAT,"ICICI BANK LTD., NEAR MIRA PETROL PUMP, BURNIHAT - 793101, AMJOK, DIST. RI BHOI, MEGHALAYA",RI BHOI,BURNIHAT,MEGHALAYA,0
2486,ICICI BANK LIMITED,ICIC0002624,CANDOLIM,"ICICI BANK LTD., UNIQUE ARCADE, CAMOTIM WARD, TINTO, CANDOLIM MARKET, GOA - 403515",NORTH GOA,CANDOLIM,GOA,0
2487,ICICI BANK LIMITED,ICIC0002625,UMROI,UMROI MILITARY STATION SHOPPING COMPLEX CO 99APO DIST RI BHOI MEGHALAYA 900203,RI BHOI,UMROI,MEGHALAYA,0
2488,ICICI BANK LIMITED,ICIC0002626,LOVELY PROFESSIONAL UNIVERSITY(LPU),"JALANDHAR-DELHI GT ROAD,NH-I,VILLAGE CHAHERU,TEHSIL PHAGWARA,DISTRICT KAPURTHALA,PUNJAB-144411",KAPURTHALA,PHAGWARA,PUNJAB,0
2489,ICICI BANK LIMITED,ICIC0002627,CHANDGAD,"ICICI BANK LTD.,260/A/B GURUWAR PETH, MAIN ROAD, CHANDGAD, DIST- KOLHAPUR. 415509.",KOLHAPUR,CHANDGAD,MAHARASHTRA,0
2490,ICICI BANK LIMITED,ICIC0002628,CHANDRANAGAR,"ICICI BANK LTD., SKS SONS COMPLEX PIRVUSALA,CHANDRANAGAR (P.O),PALAKKAD-678007,KERALA",PALAKKAD,CHANDRANAGAR,KERALA,0
2491,ICICI BANK LIMITED,ICIC0002629,CHICALIM,"ICICI BANK LTD, PLOT NO. 7, MARSHAL PINTO ROAD, CHICALIM - 403802, VASCO, SOUTH GOA DIST, GOA",SOUTH GOA,CHICALIM,GOA,0
2492,ICICI BANK LIMITED,ICIC0002630,BANIKHET,MAIN CHAMBA ROAD BANIKHET DISTT CHAMBA PIN 176303,CHAMBA,BANIKHET,HIMACHAL PRADESH,9816188946
2493,ICICI BANK LIMITED,ICIC0002631,DARED,"ICICI BANK LTD., GOLDEN POINT COMPLEX, PHASE III, GIDC, DARED - 361004,JAMNAGAR DIST., GUJARAT",JAMNAGAR,DARED,GUJARAT,0
2494,ICICI BANK LIMITED,ICIC0002632,GAIRATGANJ,"ICICI BANK LTD., NANDINI NAGAR, SAGAR ROAD, GAIRATGANJ - 464884,┬áRAISEN DIST., MADHYA PRADESH",RAISEN,RAISEN,MADHYA PRADESH,0
2495,ICICI BANK LIMITED,ICIC0002633,JORETHANG,"ICICI BANK LTD., CIRCULAR ROAD, PO. JORETHANG - 737121,┬áDIST. SOUTH SIKKIM, SIKKIM",SOUTH SIKKIM,JORETHANG,SIKKIM,0
2496,ICICI BANK LIMITED,ICIC0002634,BOKAKHAT,"ICICI BANK LTD,BOKAKHAT BARNCH,KHETAN BHAWAN,BOKAKHAT,NH-37,DIST - GOLAGHAT,ASSAM-785612",GOLAGHAT,BOKAKHAT,ASSAM,0
2497,ICICI BANK LIMITED,ICIC0002635,LUMDING,ICICI BANK LTD LUMDING BRANCH LANKA ROAD NEAR SBI LUMDING DIST-NAGAON ASSAM-782447,NAGAON,LUMDING,ASSAM,0
2498,ICICI BANK LIMITED,ICIC0002636,KOTTIYAM,ICICI BANK LTD DHANYA BUILDING UMAYANALLOOR P O PARAKKULAM KOTTIYAM 691589 KOLLAM DIST KERALA,KOLLAM,KOTTIYAM,KERALA,996131233
2499,ICICI BANK LIMITED,ICIC0002637,KUMBALAGODU,"ICICI BANK LTD., RAJARAJESHWARI ENGINEERING OF COLLEGE, KUMBALAGODU - 560074, NO.14, ROMOJHALLI CROSS, MYSORE ROAD,┬áDIST. BANGALORE URBAN, KARNATAKA",BANGALORE URBAN,KUMBALAGODU,KARNATAKA,0
