,BANK NAME,IFSC,OFFICE,ADDRESS,DISTRICT,CITY,STATE,PHONE
3752,ICICI BANK LIMITED,ICIC0003960,TIRUKKOYILUR,"ICICI BANK LTD,NO 111 NORTH STREET TIRUKKOYILUR",VILLUPURAM,TIRUKOILUR,TAMIL NADU,4146223977
3753,ICICI BANK LIMITED,ICIC0003961,ODDANCHATRAM,ICICI BANK LTD NO 395 DINDIGUL PALANI MAIN ROAD NEAR INDIAN COMPLEX ODDANCHATRAM DINDIGUL 624619,DINDIGUL,ODDANCHATRAM,TAMIL NADU,7807000000
3754,ICICI BANK LIMITED,ICIC0003962,KULITHALAI,ICICI BANK LTD 28 29 30 SUHAN COMPLEX KARUR MAIN ROAD NEAR POLICE STATION KARUR KULITHALAI 639104,KARUR,KULITHALAI,TAMIL NADU,7695039158
3755,ICICI BANK LIMITED,ICIC0003963,ANTHIYUR,"ICICI BANK NO.238/8,DHANSRI COMPLEX,OPP THALUK OFFICE,KAMARAJAR SALAI,BARBOUR ROAD,ANTHIYUR 638501",ERODE,ERODE,TAMIL NADU,8754484450
3756,ICICI BANK LIMITED,ICIC0003964,ELAMPILLAI,ICICI BANK LTD NO.45 1B SUBRAMANIAR STREET II SANTHAPETTAI ROAD ELAMPILLAI 637 508,SALEM,ELAMPILLAI,TAMIL NADU,7823981634
3757,ICICI BANK LIMITED,ICIC0003965,THURAIYUR,"ICICI BANK LTD,199/2A,TRICHY ROAD MADHURAPURI,THURAIYUR,TAMILNADU 621010",TIRUCHIRAPALLI,TURAIYUR,TAMIL NADU,9585526545
3758,ICICI BANK LIMITED,ICIC0003966,THIRUTHURAIPOONDI,"ANANDHA INN COMPLEX, TIRUVARUR ROAD,NEAR SRI MURUGAN STORES, THIRUTHURAIPOONDI.PIN 614713",THIRUVARUR,TIRUTURAIPUNDI,TAMIL NADU,9677813205
3759,ICICI BANK LIMITED,ICIC0003967,BARWALA,ICICI BANK LTD MAIN MARKET DERABASSI BARWALA ROAD BARWALA PANCHKULA PIN 134118,PANCHKULA,BARWALA,HARYANA,0
3760,ICICI BANK LIMITED,ICIC0003968,KHARKHODA,OPP CIVIL HOSPITAL THANA KALAN ROAD KHARKHODA 131402 DISTT SONIPAT,SONIPAT,SONIPAT,HARYANA,7082902414
3761,ICICI BANK LIMITED,ICIC0003969,WALAJAPET,"NO.20, BUJANARAO STREET, MBT ROAD, WALAJAPET, VELLORE DT, PIN - 632513",VELLORE,WALAJAPET,TAMIL NADU,7305380279
3762,ICICI BANK LIMITED,ICIC0003970,RAJARHAT GOPALPUR SIDDHA PINE,OPPOSITE DEROZIO COLLEGE RAJARHAT ROAD KALI PARK BABLATALA GOPALPUR GRAM KOLKATA 700136,KOLKATA,KOLKATA,WEST BENGAL,9230701557
3763,ICICI BANK LIMITED,ICIC0003971,SALT LAKE CITY BAISAKHI,BG 16 SECTOR 2 SALT LAKE CITY BAISAKHI KOLKATA 700029,KOLKATA,KOLKATA,WEST BENGAL,0
3764,ICICI BANK LIMITED,ICIC0003972,Kakkanad - Smartcity,"ICICI Bank Ltd., C-108, First Floor, Northern Wing, SCK-01 Building, Kakkanad, Kochi, Kerala - 682042",ERNAKULAM,ERNAKULAM,KERALA,9037088810
3765,ICICI BANK LIMITED,ICIC0003973,INFO PARK MAIN BRANCH,INFO PARK MAIN BRANCH GROUND FLR CARNIVAL FOOD COURT INFO PARK ROAD KAKKANAD KERALA 682030.,ERNAKULAM,ALUVA,KERALA,8590514820
3766,ICICI BANK LIMITED,ICIC0003975,NOIDA,"ICICI BANK LTD,SHOP NO 2-3,PLOT NO GH01B,SECTOR 78,NOIDA,DIST GAUTAM BUDH NAGAR.UP,201301",GAUTAM BUDDHA NAGAR,NOIDA,UTTAR PRADESH,0
3767,ICICI BANK LIMITED,ICIC0003976,RADAUR,KHASRA NO 1204 3 NEAR BUS STAND JAAT MARKET RADAUR 135133,YAMUNANAGAR,YAMUNANAGAR,HARYANA,0
3768,ICICI BANK LIMITED,ICIC0003977,DHANORI,SHOP NO 1 2 3 4 GROUND FLOOR TIRUPATI KASHIGANGA S NO 16 31 B DHANORI PUNE 411015,PUNE,PUNE,MAHARASHTRA,9272202569
3769,ICICI BANK LIMITED,ICIC0003978,RAMAN,BT7BBRRRTMDBT530UJBD,BATHINDA,RAMAN,PUNJAB,242807
3770,ICICI BANK LIMITED,ICIC0003979,MALOUD BRANCH,SCF 22 GRAIN MARKET MALOUD BRANCH TEHSIL PAYAL DISTT LUDHIANA.PUNJAB 141119,LUDHIANA,MALAUDH,PUNJAB,9868246190
3771,ICICI BANK LIMITED,ICIC0003980,SIDHWAN BET,ICICI BANK LTD LUDHIANA ROAD VILLAGE SIDHWAN BET TEHSIL JAGRAON DISTT LUDHIANA PUNJAB 142033,LUDHIANA,SIDHWAN BET,PUNJAB,9478944442
3772,ICICI BANK LIMITED,ICIC0003981,THAPAR UNIVERSITY PATIALA,ICICI BANK LTD.POST BOX NO 32 THAPAR UNIVERSITY BHADSON ROAD PATIALA 147004,PATIALA,PATIALA,PUNJAB,0
3773,ICICI BANK LIMITED,ICIC0003982,BURHAN KA TALA,ICICI BANK LTD BURHAN KLA TALA BARMER PIN 344702,BARMER,BARMER,RAJASTHAN,982230026
3774,ICICI BANK LIMITED,ICIC0003983,SHAHPUR,ICICI BANK LTD NEAR PRIMARY SCHOOL VILL SHAHPUR PO BUZARK TEH SAMANA DISTT.PATIALA PUNJAB,PATIALA,SAMANA,PUNJAB,8437006333
3775,ICICI BANK LIMITED,ICIC0003985,SECTOR NOIDA,PLOT NO 20 21 AMENITY BLOCK SECTOR 135 NOIDA 201301,GAUTAM BUDDHA NAGAR,NOIDA,UTTAR PRADESH,7982555421
3776,ICICI BANK LIMITED,ICIC0003986,HOOVINA HADAGALI,ICICI BANK LTD TMC NO 177A 67 1ST FLOOR HARAPANAHALLI ROAD HOOVINA HADAGLI583219 BELLARY KARNATAKA,BELLARY,HUVINA HADGALLI,KARNATAKA,9972842592
3777,ICICI BANK LIMITED,ICIC0003987,KAGWAD,ICICI BANK LTD NO942 A 1 1B 2 1 PLOT NO 20 BELGAUM MIRAJ ROAD KAGWAD TQ ATHANI,BELGAUM,KAGWAD,KARNATAKA,0
3778,ICICI BANK LIMITED,ICIC0003988,KARYAL,NEAR CHRUCH VILLAGE KARYAL TEHSIL AJNALA AMRITSAR,AMRITSAR,KARYAL,PUNJAB,7087235263
3779,ICICI BANK LIMITED,ICIC0003989,BHINDI AULAKH KHURD,VPO BHINDI AULKAH AJNALA PIN 143102,AMRITSAR,BHINDI SAYDAN,PUNJAB,8146672485
3780,ICICI BANK LIMITED,ICIC0003990,BHAYLI,"SHOP NO 7-10 RAJAJPATH, BESIDES BRIGHT SCHOOL, VASNA BHAYLI ROAD, VADODARA - 391410 GUJARAT",VADODARA,VADODARA,GUJARAT,9512600372
3781,ICICI BANK LIMITED,ICIC0003991,MANAS,ICICIBANKLTD VPO MANAS TEHSIL KAITHAL DISTRICT KAITHAL,KAITHAL,KAITHAL,HARYANA,0
3782,ICICI BANK LIMITED,ICIC0003992,ICICIBANK PADLA,ICICI BANK LTD VPO PADLA TEHSIL KAITHAL DISTRICT KAITHAL,KAITHAL,KAITHAL,HARYANA,0
3783,ICICI BANK LIMITED,ICIC0003993,KALKAJI MAIN MARKET,G1 G2 LGF1 BLOCK F1 KALKAJI MAIN MARKET NEW DELHI 19,DELHI,DELHI,DELHI,49875431
3784,ICICI BANK LIMITED,ICIC0003994,TAGORE PARK MODEL TOWN,"302,TAGORE PARK MODEL TOWN 1 NEW DELHI -110009",DELHI,DELHI,DELHI,1122222222
3785,ICICI BANK LIMITED,ICIC0003995,M G ROAD SASTRI NAGAR,ICICI BANK LTD 6 4 MAHATMA GANDHI ROAD NEAR SASTRI NAGAR THIRUVANMIYUR CHENNAI 600041,CHENNAI,CHENNAI,TAMIL NADU,9543578427
3786,ICICI BANK LIMITED,ICIC0003996,THARA,3 TO 7 RATANAKAR SQUARE HIGHWAY ROAD THARA DIST BANASKANTHA GUJARAT 385555,BANAS KANTHA,BANAS KANTHA,GUJARAT,0
3787,ICICI BANK LIMITED,ICIC0003997,BHABHAR,ICICI BANK LTD SHOP NO 7 8 9 27 28 SATYAM SUPER MARKET OPP.APMC BHABHAR 385320,BANAS KANTHA,BHABHAR JUNA VAS,GUJARAT,0
3788,ICICI BANK LIMITED,ICIC0003998,POSTA,ICICI BANK LTD.34 F MAHERSI DEVENDRA ROAD NEAR DALPATTI.KOLKATA 700006.WEST BENGAL,KOLKATA,KOLKATA,WEST BENGAL,8232951165
3789,ICICI BANK LIMITED,ICIC0003999,JAMJODHPUR,ICICI BANK LTD SARVODAY CORPORATION STATION ROAD JAM JODHPUR 360530,JAMNAGAR,JAMJODHPUR,GUJARAT,2898000000
3790,ICICI BANK LIMITED,ICIC0004001,REPALLE,"ICICI BANK LTD,D.NO 12-17-10/4,YENDURU COMPLEX,MAIN ROAD,RING ROAD CENTER,REPALLE-522265",GUNTUR,REPALLE,ANDHRA PRADESH,0
3791,ICICI BANK LIMITED,ICIC0004002,NARSIPATNAM,"ICICI BANK LTD, SAI PLAZA OPP SUB COLLECTOR OFFICE, NARSIPATNAM VISAKHAPATNAM 531116.",VISAKHAPATNAM,NARSIPATNAM,ANDHRA PRADESH,1
3792,ICICI BANK LIMITED,ICIC0004003,C JANAKPURI,C 3 10 UPPER GROUND FLOOR JANAKPURI NEW DELHI-110058,DELHI,DELHI,DELHI,9213000000
3793,ICICI BANK LIMITED,ICIC0004004,KATTUR,ICICI BANK LTD GD ARCADE PLOT NO-9 SAKTHI NAGAR KATTUR TRICHY 600019,TIRUCHIRAPALLI,TIRUCHIRAPALLI,TAMIL NADU,7305043582
3794,ICICI BANK LIMITED,ICIC0004005,BHADSON,SCO 17 GRAIN MARKET NABHA AMLOH ROAD BHADSON 147202,PATIALA,BHADSON,PUNJAB,7087110458
3795,ICICI BANK LIMITED,ICIC0004006,KHERALU,SHPO NO 1 TO 4 PUSHPCHANDRA COMPLEX VRUNDAVAN CHAR RASTA KHERALU MEHASANA 384325,MAHESANA,KHERALU,GUJARAT,0
3796,ICICI BANK LIMITED,ICIC0004007,LALGUDI,"ICICI BANK LTD,104/2 MRV NAGAR,POOVAALUR ROAD,LALGUDI,TRICHY,TAMILNADU-621601",TIRUCHIRAPALLI,LALGUDI,TAMIL NADU,9751518050
3797,ICICI BANK LIMITED,ICIC0004008,PITHAPURAM,"ICICI BANK LTD, D NO 3 2 94A, MAIN ROAD OPPOSITE SAI BABA TEMPLE,PITHAPURAM 533450.",EAST GODAVARI,PITHAPURAM,ANDHRA PRADESH,1111111
3798,ICICI BANK LIMITED,ICIC0004009,GOLE MARKET,108 BANGLA SAHIB MARG GOLE MARKET NEW DELHI DELHI 110001,DELHI,DELHI,DELHI,0
3799,ICICI BANK LIMITED,ICIC0004010,JHALDA,WORD NO PO AND PS JHALDA DEVI BLOCK RANCHI ROAD PURULIA 723202,PURULIYA,JHALDA,WEST BENGAL,9830129909
3800,ICICI BANK LIMITED,ICIC0004011,BURDWAN BAZAR,ICICI BANK LTD LAXMIPUR MATH 301 G T ROAD P S BURDWAN DIST.BURDWAN WEST BENGAL,BARDDHAMAN,BARDDHAMAN,WEST BENGAL,8927304120
3801,ICICI BANK LIMITED,ICIC0004012,PHULWARISHARIF,"ICICI BANK LTD,MS TOWER, PHULWARISHARIF,PATNA-801505",PATNA,PHULWARI SHARIF,BIHAR,60899255
3802,ICICI BANK LIMITED,ICIC0004013,POR,1 AND 2 SWAMINARAYAN COMPLEX POR KAYAVAROHAN ROAD VADODARA 391243,VADODARA,POR,GUJARAT,9879443259
3803,ICICI BANK LIMITED,ICIC0004014,BURARI,ICICI BANK LTD PLOT NO 876 2 MAIN ROAD SANT NAGAR BURARI DELHI 110084,DELHI,DELHI,DELHI,0
3804,ICICI BANK LIMITED,ICIC0004015,PATEL NAGAR,"ICICI BANK LTD, ASTHA BUILDING, DR BHATTACHARYA ROAD, WEST PATEL NAGAR PATNA 800023.",PATNA,PATNA,BIHAR,0
3805,ICICI BANK LIMITED,ICIC0004016,DHANDHUKA,MARUTI COMPLEX NEAR VAISHNAV SOCIETY BHAVNAGAR ROAD DHANDHUKA AHMEDABAD-382460,AHMADABAD,AHMEDABAD,GUJARAT,9016896268
3806,ICICI BANK LIMITED,ICIC0004017,EAST PATEL NAGAR,ICICI BANK LTD 30 27 EAST PATEL NAGAR NEW DELHI 110008,DELHI,DELHI,DELHI,1143401288
3807,ICICI BANK LIMITED,ICIC0004018,SHEIKHPURA,ICICI BANK LTD D N PLAZA KHAND PAR OPP DAAL KUAN SHEIKHPURA 811105,SHEIKHPURA,SHEIKHPURA,BIHAR,6341
3808,ICICI BANK LIMITED,ICIC0004019,EAST PUNJABI BAGH,1 13 EAST PUNJABI BAGH DELHI 110026,DELHI,DELHI,DELHI,9971256778
3809,ICICI BANK LIMITED,ICIC0004020,UDYOG NAGAR-DSIDC,I 11 DSIDC UDYOG NAGAR ROHTAK ROAD NEW DELHI 110041,DELHI,DELHI,DELHI,9205597732
3810,ICICI BANK LIMITED,ICIC0004021,SOUTH EX PART,D 35 SOUTH EX PART 1 NEW DELHI 110049,DELHI,DELHI,DELHI,9213000000
3811,ICICI BANK LIMITED,ICIC0004022,PATJIRWA,"ICICI BANK LTD,UTTARAI PATJIRWA,WARD NO.3,PUJAHAN PATJIRWA,WEST CHAMPARAN,BIHAR -845438",PASCHIMI CHAMPARAN,BETTIAH,BIHAR,7279872303
3812,ICICI BANK LIMITED,ICIC0004023,MAMRAKHA,"ICICI BANK LTD,MAMRAKHA BAJAR MAIN ROAD BHAIA TOLA MALAHI EAST CHAMPARAN BIHAR-845425",PURBI CHAMPARAN,MOTIHARI,BIHAR,7321812584
3813,ICICI BANK LIMITED,ICIC0004024,BAMANPUKUR ISKCON,ISKCON COMPOUND PILGRIM AND VISITORS TRUST VAMSI BHAWAN SRI DHAM MAYAPUR NADIA WB 741313,NADIA,NADIA,WEST BENGAL,8509416984
3814,ICICI BANK LIMITED,ICIC0004025,GINJAS,"ICICI BANK LTD,GINJAS MORE,BASRA BAZAR,PO -JAINTHPUR,MUZAFFARPUR,BIHAR,PIN - 843123",MUZAFFARPUR,MUZAFFARPUR,BIHAR,9931696855
3815,ICICI BANK LIMITED,ICIC0004026,DLF CORPORATE GREENS,ICICI BANK LTD DCG2 0017 DLF CORPORATE GREENS SECTOR 74A GURGAON,GURGAON,ABHEYPUR,HARYANA,4123456
3816,ICICI BANK LIMITED,ICIC0004027,SAROTAR,ICICI BANK LTD SAROTAR PO SAROTAR PIN CODE-845423,PURBI CHAMPARAN,MOTIHARI,BIHAR,7261051468
3817,ICICI BANK LIMITED,ICIC0004028,DERATHOO,ICICI BANK LTD GRAM PANCHAYAT VILLAGE DERATHOO NASIRABAD DIST AJMER RAJASTHAN PIN 305601,AJMER,AJMER,RAJASTHAN,0
3818,ICICI BANK LIMITED,ICIC0004029,MANJIWALA,ICICI BANK LTD GRAM PANCHAYAT BHAWAN VILLAGE POST MANJIWALA TH PACHPADRA BARMER-344022,BARMER,BALOTRA,RAJASTHAN,0
3819,ICICI BANK LIMITED,ICIC0004030,ICICI BANK LTD,ICICI BANK LTD SCF 15 PHASE 3B2 MOHALI.PIN CODE 160059,SAHIBZADA AJIT SINGH NAGAR,LANDRAN,PUNJAB,9988007927
3820,ICICI BANK LIMITED,ICIC0004031,HERITAGE CHAMBERS,GROUND FLOOR HERITAGE CHAMBERS AZAD SOCIETY B H SHAHJANAND COLLEGE NEHRUNAGAR AHMEDABAD 380015,AHMADABAD,AHMEDABAD,GUJARAT,9033003987
3821,ICICI BANK LIMITED,ICIC0004033,MANJUSAR,"SHOP NO 34-37,SOLACE PLAZA,NEAR GIDC GATE,SAVLI ROAD,MANJUSAR,VADODARA",VADODARA,MANJUSAR,GUJARAT,8690242214
3822,ICICI BANK LIMITED,ICIC0004035,NATHAM MADURAI MAIN ROAD,14 A DHARBAR NAGAR MADURAI MAIN ROAD NATHAM 624401,DINDIGUL,NATHAM,TAMIL NADU,0
3823,ICICI BANK LIMITED,ICIC0004036,SEC DWARKA,PLOT NO 9 SECTOR 10 DWARKA 110075,DELHI,DELHI,DELHI,9310334902
3824,ICICI BANK LIMITED,ICIC0004037,BERI,"ICICI BANK LTD,JAHAJGARH MAIN ROAD,BERI,DISTT ROHTAK,HARYANA",JHAJJAR,JHAJJAR,HARYANA,7082118261
3825,ICICI BANK LIMITED,ICIC0004038,VADGAON MAVAL,GROUND FLOOR HOUSE NO 45 CST 509 POST VADGAON MAVAL STATION ROAD TALUKA MAVAL PUNE 412106,PUNE,PUNE,MAHARASHTRA,8657396632
3826,ICICI BANK LIMITED,ICIC0004039,TECH MAHINDRA HITEC CITY,ICICI BANK LTD TECH MAHINDRA BASEMENT PLOT NO 22 25& 27 34 TOWER 2 HITECH CITY MADHAPUR,HYDERABAD,HYDERABAD,TELANGANA,0
3827,ICICI BANK LIMITED,ICIC0004040,CHANKYAPURI BRANCH,ICICI BANK LTD SHOP NO 8 9 GANESH MERIDIAN A KARGIL CROSS ROAD CHANKYAPURI AHMEDABAD 380061,AHMADABAD,AHMEDABAD,GUJARAT,9228000586
3828,ICICI BANK LIMITED,ICIC0004041,ICICI BANK LTD,MAHINDRA SATYAM SCHOOL OF LEADERSHIP TECHNOLOGY SY NO62 1A BAHADURPALLY HYDERABAD.,HYDERABAD,HYDERABAD,TELANGANA,33667777
3829,ICICI BANK LIMITED,ICIC0004042,OFFICERS COLONY PADI,NO 11 ELANGO NAGAR MAIN ROAD OFFICERS COLONY PADI CHENNAI 600050,CHENNAI,CHENNAI,TAMIL NADU,9894771375
3830,ICICI BANK LIMITED,ICIC0004043,BHIT BHERWA,ICICI BANK LTD VILLAGE& PO BHITBHERWA PS GOPALGANJ DIST GOPALGANJ BIHAR PIN 841428,GOPALGANJ,GOPALGANJ,BIHAR,0
3831,ICICI BANK LIMITED,ICIC0004044,KOODAL NAGAR,BNTNWNPPUNNGMU6508.,MADURAI,MADURAI,TAMIL NADU,9840807073
3832,ICICI BANK LIMITED,ICIC0004046,SABALPUR,HARI COMPLEX ALAMPUR KACCHIDARGAH P S DIDARGUNJ PATNA 803201,PATNA,PATNA,BIHAR,0
3833,ICICI BANK LIMITED,ICIC0004047,VANAGARAM,SHOP NO 1 GURU BRINDAVAN GARDEN VANAGARAM AMBATTUR MAIN ROAD CHENNAI 600095,CHENNAI,CHENNAI,TAMIL NADU,9995374938
3834,ICICI BANK LIMITED,ICIC0004048,HALDIBARI BRANCH,ICICIBANK LTD MITRA MARKET COMPLEX HALDIBARI WARD NO 10 KOCHBIHAR WB 735122,KOCH BIHAR,HALDIBARI,WEST BENGAL,0
3835,ICICI BANK LIMITED,ICIC0004049,CHINNAMANUR,176 5 GROUND FLOOR PALAYAM ROAD K K KULAM CHINNAMANUR THENI DIST,THENI,CHINNAMANUR,TAMIL NADU,0
3836,ICICI BANK LIMITED,ICIC0004050,MANAWAR,ICICI BANK LTD NEAR RAKESH MARBLES SINGHANA ROAD MANAWAR DIST DHAR MADHYA PRADESH,DHAR,MANAWAR,MADHYA PRADESH,8109046090
3837,ICICI BANK LIMITED,ICIC0004051,ARVI,ICICI BANK LTD SHOP NO 9 10 11 12 13 BESIDES MEDHA PETROLIUM ARVI DIST WARDHA,WARDHA,ARVI,MAHARASHTRA,0
3838,ICICI BANK LIMITED,ICIC0004052,SATANA,ICICI BANK LTD GR FLOOR SHOP NO 10 11 12 CTS NO 1045 K T COMPLEX NR BUS STAND SATANA NASIK 423301,NASIK,NASHIK,MAHARASHTRA,9272202702
3839,ICICI BANK LIMITED,ICIC0004053,MANWATH,PLOT NO 8-10-118 GROUND FLOOR ATHOWADI BAZAR GOLAIT NAGAR NEAR BUS STOP MANWATH DIST PARBHANI,PARBHANI,MANWATH,MAHARASHTRA,2451240787
3840,ICICI BANK LIMITED,ICIC0004054,NANHERA,ICIC BANK LTD PO HARCHANDPURA SAMANA SHATRANA TEHSIL PATRAN DIST PATIALA,PATIALA,SAMANA,PUNJAB,8437006333
3841,ICICI BANK LIMITED,ICIC0004055,SARSANA,KHASRA NO 83 9 2 6 15 VILLAGE SARSANA POST PANIHARI VILLAGE SARSANA 125121,HISAR,BARWALA,HARYANA,9896452488
3842,ICICI BANK LIMITED,ICIC0004056,KIRORI,KHASRA NO 705 AGROHA BARWALA ROAD VILLAGE KIRORI DISTT HISAR HARYANA 125112,HISAR,BARWALA,HARYANA,9896452488
3843,ICICI BANK LIMITED,ICIC0004057,MEHKAR,"ICICI BANK LTD,GAROLE COMPLEX,NEAR RATHOD HOSPITAL,DONGAON ROAD.MEHKAR",BULDHANA,MEHKAR,MAHARASHTRA,0
3844,ICICI BANK LIMITED,ICIC0004058,MORSHI,ICICI BANK LTD PLOT NI 21/1 GROUND FLOOR NACHONE COMPLEX WARD NO 1 MORSHI 444905,AMRAVATI,MORSHI,MAHARASHTRA,9860456365
3845,ICICI BANK LIMITED,ICIC0004059,JABALPUR - KACHGHAR,ICICI BANK LTD.HOUSE NO 581 1 WARD NO.46 EAST GHAMAPUR KACHGHAR JABALPUR M.P.482005,JABALPUR,JABALPUR,MADHYA PRADESH,0
3846,ICICI BANK LIMITED,ICIC0004060,TANSEN NAGAR,ICICI BANK LTD TANSEN ROAD TANSEN NAGAR GWALIOR 474002,GWALIOR,GWALIOR,MADHYA PRADESH,7514700101
3847,ICICI BANK LIMITED,ICIC0004061,NIRGUNDI,"RAJIB GANDHI SEVA KENDRA,NIRGUNDI,ICCHADA,BARIKPUR,BHADRAK",BHADRAK,BHADRAK,ODISHA,9692761945
3848,ICICI BANK LIMITED,ICIC0004062,RAJGARH,ICICI BANK LTD CHANDRA SHEKHAR MARG NEAR MANDI GATE RAJGARH DHAR M P,DHAR,SARDARPUR,MADHYA PRADESH,9039001634
3849,ICICI BANK LIMITED,ICIC0004063,TARIKERE,TMC NO 5904 52 UPPARABASAVANAHALLI BH ROAD KASABA TARIKERE DIST CHIKMAGALUR KARNATAKA 577228,CHIKMAGALUR,TARIKERE,KARNATAKA,0
3850,ICICI BANK LIMITED,ICIC0004064,KADUR,"NO 2301/2189,WARD NO 8 DEVARAJ URS MAIN ROAD VENKATESHWAR NAGAR UNDER BRIDGE ROAD KADUR-577548",CHIKMAGALUR,KADUR,KARNATAKA,0
3851,ICICI BANK LIMITED,ICIC0004065,RAMANAKKAPETA,ICICI BANK LTD 4 48 RAMANAKKAPETA U KOTTAPALLI MANDALM EAST GODAVARI ANDHRA PRADESH 533447,EAST GODAVARI,NAGULAPALLI,ANDHRA PRADESH,0
3852,ICICI BANK LIMITED,ICIC0004066,SATPUR TRIMBAK ROAD,GROUNT FLOOR SHOP NO 3 AND 4 BRICK ENCLAVE OPP PAPAYA NURSARY TRIMBAK ROAD NASIK,NASIK,NASHIK,MAHARASHTRA,0
3853,ICICI BANK LIMITED,ICIC0004067,KAGDAR BHATIA,"WARD NO.3, MUKAM, POST KAGDAR BHATIA, DIST UDAIPUR NH-8 KAGDAR DAM ROAD RAJ.",UDAIPUR,UDAIPUR,RAJASTHAN,0
3854,ICICI BANK LIMITED,ICIC0004068,MKB NAGAR,NO 311 WEST AVENUE ROAD MKB NAGAR VYSARPADI CHENNAI 39,CHENNAI,CHENNAI,TAMIL NADU,0
3855,ICICI BANK LIMITED,ICIC0004069,GIRWAR,"ICICI BANK LTD,MAIN ROADD GIRWAR TEH-ABUROAD DISTT-SIROHI STATE-RAJASTHAN PIN-307026",SIROHI,ABU ROAD,RAJASTHAN,0
3856,ICICI BANK LIMITED,ICIC0004070,KOMTA,ICICI BANK LTD GRAM PANCHAYAT BHAVAN VILL KOMTA TH SAYLA DIS JALORE RAJASTHAN 343030,JALOR,JALORE,RAJASTHAN,0
3857,ICICI BANK LIMITED,ICIC0004071,MORI GATE DELHI,2760-61 HAMILTON ROAD MORI GATE DELHI,DELHI,DELHI,DELHI,0
3858,ICICI BANK LIMITED,ICIC0004072,TIRUKKALIKUNDRAM,NO 32 KAMMALAR STREET TIRUKKALIKUNDRAM 603109,THIRUVALLUR,TIRUKKALIKUNDRAM,TAMIL NADU,9884445797
3859,ICICI BANK LIMITED,ICIC0004073,UTHANGARAI,22/18 SALEM MAIN ROAD NEAR ROUNDANA UTHANGARAI KRISHNAGIRI DT.635207,KRISHNAGIRI,KRISHNAGIRI,TAMIL NADU,0
3860,ICICI BANK LIMITED,ICIC0004074,JANKIPURAM EXTENSION,"GROUND FLOOR CHANDRIKA TOWER SECTOR 3 JANKIPURAM EXTENSION LUCKNOW 226021,UP",LUCKNOW,LUCKNOW,UTTAR PRADESH,7525037516
3861,ICICI BANK LIMITED,ICIC0004075,AJEETGARH,"ICICI BANK LIMITED, OPP HOTEL NARAYAN PALACE, TRIVENI ROAD, AJEETGARH, DIST SIKAR, RAJ-332701",SIKAR,AJITGARH,RAJASTHAN,0
3862,ICICI BANK LIMITED,ICIC0004076,KHAJUWALA,SHOP NO 6 DHAN MANDI KAHJUWALA BIKANER 334023,BIKANER,BIKANER,RAJASTHAN,1520223088
3863,ICICI BANK LIMITED,ICIC0004077,CHARKARA,ICICI BANK LTD CHARKARA VILLAGE CHARKARA TH NOKHA DIST BIKANER 334803 RAJASTHAN,BIKANER,NOKHA,RAJASTHAN,220077
3864,ICICI BANK LIMITED,ICIC0004078,VEDVYASPURI MEERUT,PLOT NO 1000M VILLAGE GHAT NEAR DWARIKA HEIGHTS VEDVYASPURI NH58 MEERUT UTTAR PRADESH 250002,MEERUT,MEERUT,UTTAR PRADESH,5039423
3865,ICICI BANK LIMITED,ICIC0004079,KANPUR KALYANPUR,ICICI BANK LTD GC 26 AWAS VIKAS SCHEME NO 1 KESHAWPURAM KALYANPUR KANPUR 208017,KANPUR CITY,KANPUR,UTTAR PRADESH,0
3866,ICICI BANK LIMITED,ICIC0004080,MEERUT SARDHANA,ICICI BANK LTD TOWN HALL ROAD NEAR SYNDICATE BANK SARDHANA MEERUT 250342,MEERUT,SARDHANA,UTTAR PRADESH,1109245
3867,ICICI BANK LIMITED,ICIC0004081,GADARPUR,H NO 1 WARD 3 GADARPUR DISTT.UDHAM SINGH NAGAR UTTRAKHAND 263152,UDHAM SINGH NAGAR,GADARPUR,UTTARAKHAND,9045001391
3868,ICICI BANK LIMITED,ICIC0004082,BIR KAULI,ICICI BANK LTD BIR KAULI RAILWAY STATION PATIALA 140701,PATIALA,KAULI,PUNJAB,8146672399
3869,ICICI BANK LIMITED,ICIC0004083,DEVALAPURA,ICICI BANK LTD VPO 203 3 DEVALAPURA VILLAGE TQ HOSPET DIST BELLARY PIN 583129 KARNATAKA,BELLARY,METRI,KARNATAKA,0
3870,ICICI BANK LIMITED,ICIC0004084,BASAPUR,ICICI BANK LTD NEAR BUS STAND HULIGI ROAD BASAPUR,KOPPAL,SANAPUR,KARNATAKA,0
3871,ICICI BANK LIMITED,ICIC0004085,YARRINGALIGI,ICICI BANK LTD V P NO 95 YARRINGALIGI VILLAGE TALUKA DISTRICT BELLARY KARNATAKA.583115,BELLARY,BELLARY,KARNATAKA,9108467042
3872,ICICI BANK LIMITED,ICIC0004086,MUKHASAPARUR,MANGALAM PETTAIL MAIN ROAD MUKHASAPARUR CUDDALORE DISTRICT 606104,CUDDALORE,VRIDHACHALAM,TAMIL NADU,0
3873,ICICI BANK LIMITED,ICIC0004087,SEPPAKKAM,60 SOUTH STREET SEPPAKKAM CUDDALORE DISTRICT 606302,CUDDALORE,VRIDHACHALAM,TAMIL NADU,0
3874,ICICI BANK LIMITED,ICIC0004088,POOTTAI,ICICI BANK LTD OLD NO 4 45 METTU STREET POOTTAI TAMIL NADU,VILLUPURAM,SANKARAPURAM,TAMIL NADU,0
3875,ICICI BANK LIMITED,ICIC0004089,PURTHIRAMPATTU,227 PURTHIRAMPATTU ROAD PURTHIRAMPATTU SANKARAPURAM TK VILLUPPURAM 606402,VILLUPURAM,SANKARAPURAM,TAMIL NADU,0
3876,ICICI BANK LIMITED,ICIC0004090,KULAMANGALAM,ICICI BANK LTD 134 MUNIYANDI KOVIL STREET KULAMANGALAM MADURAI NORTH MADURAI,MADURAI,KULAMANGALAM,TAMIL NADU,0
3877,ICICI BANK LIMITED,ICIC0004091,JAMBUKUTTAPATTI,"NO 2 29A 2 29B DHARMAPURI MAIN ROAD OPPOSITE TO TALUK OFFICE KULANOOR,POCHAMPALL",KRISHNAGIRI,KRISHNAGIRI,TAMIL NADU,0
3878,ICICI BANK LIMITED,ICIC0004092,ERRAHALLI,"NO 43,LAKSHMI NAGAR,SALEM BYEPASS ROAD,ERRAHALLI,KRISHNAGIRI 635 112",KRISHNAGIRI,KRISHNAGIRI,TAMIL NADU,0
3879,ICICI BANK LIMITED,ICIC0004093,PRATAP BAGH,H NO 15 VEER NAGAR JAIN COLONY MAIN GT ROAD RANA PRATAP BAGH DELHI 110007,DELHI,DELHI,DELHI,9015198393
3880,ICICI BANK LIMITED,ICIC0004094,TIRUNELVELI TOWN,NO 804 VOC STREET TIRUNELVELI TOWN TIRUNELVELI TAMILNADU-627006,TIRUNELVALI,TIRUNELVELI,TAMIL NADU,7601945262
3881,ICICI BANK LIMITED,ICIC0004095,SUNDER NAGAR,SUNDER NAGAR RAIPUR BRANCH ICICI BANK LTD ASHWIN NAGAR SUNDER NAGAR MAIN ROAD RAIPUR 492013,RAIPUR,RAIPUR,CHHATTISGARH,8349991869
3882,ICICI BANK LIMITED,ICIC0004096,PEOPLES MALL BHOPAL,PEOPLES CAMPUS PEOPLES MALL BHANPUR BHOPAL MP 462037,BHOPAL,BHOPAL,MADHYA PRADESH,0
3883,ICICI BANK LIMITED,ICIC0004097,ANAZ MANDI,ICICI BANK LTD SHOP NO 195 NEW ANAZ MANDI ROHTAK,ROHTAK,ROHTAK,HARYANA,8929642673
3884,ICICI BANK LIMITED,ICIC0004098,PAKAUR,BAAGAT PARA OPPSITE SDPO RESIDENCE MAIN ROAD PAKUR JHARKHAND 816107,PAKUR,PAKAUR,JHARKHAND,6435220015
3885,ICICI BANK LIMITED,ICIC0004099,GHATABILLOD,ICICI BANK LTD PATEL NAGAR MAIN ROAD GHATABILLOD DHAR 454773,DHAR,DHAR,MADHYA PRADESH,0
3886,ICICI BANK LIMITED,ICIC0004100,SWASTIK CHAMBER,ICICI BANK LTD SHOP NO 5 GROUND FLOOR SWASTIK CHAMBER CST ROAD CHEMBUR MUMBAI 400071,GREATER BOMBAY,GREATER BOMBAY,MAHARASHTRA,9699370656
3887,ICICI BANK LIMITED,ICIC0004101,MURTIZAPUR,BTYXSTTGSHTJ.,AKOLA,MURTIZAPUR,MAHARASHTRA,9028027837
3888,ICICI BANK LIMITED,ICIC0004102,GUINDY,"S-7 SIDCO INDUSTRIAL ESTATE, GUINDY, CHENNAI- 600032,TN,INDIA.",CHENNAI,CHENNAI,TAMIL NADU,4448561510
3889,ICICI BANK LIMITED,ICIC0004103,CHAKAN INDUSTRIAL ESTATE MAHALUNGE,ICICI BANK LTD GURUKRUPA COMPLEX GAT NO 392 1 OPP BAJAJ AUTO MAHALUNGE INGALE TAL KHED,PUNE,PUNE,MAHARASHTRA,0
3890,ICICI BANK LIMITED,ICIC0004104,TANK ROAD,1 11655 SAT NAGAR TANK ROAD KAROL BAGH DELHI 110005,DELHI,DELHI,DELHI,9213022865
3891,ICICI BANK LIMITED,ICIC0004105,TIRUPPUR KANGEYAM ROAD,ICICI BANK LTD NO 76 KANGEYEPALAYAM PUDHUR KANGEYAM ROAD OPP TO VELAN HOTEL TIRUPPUR 641604,COIMBATORE,COIMBATORE,TAMIL NADU,0
3892,ICICI BANK LIMITED,ICIC0004106,LULU CYBER PARK,GROUND FLOOR LULU CYBER TOWER INFOPARK SEZ KAKKANAD KOCHI PIN 682042,ERNAKULAM,KOCHI,KERALA,9895655933
3893,ICICI BANK LIMITED,ICIC0004107,BANGALORE BEGUR MAIN ROAD,ICICI BANK LTD NO 35 BEGUR MAIN ROAD 10TH HONGA SANDRA BANGALORE KARNATAKA,BANGALORE URBAN,BEGUR,KARNATAKA,0
3894,ICICI BANK LIMITED,ICIC0004108,JUBILEE HILLS RD,ICICI BANK LTD PLOT NO 271 APURUPA BUILDING G1 ROAD NO 10 JUBILEE HILLS HYDERABAD 500033,HYDERABAD,HYDERABAD,TELANGANA,0
3895,ICICI BANK LIMITED,ICIC0004109,QUTUB INSTITUTIONAL AREA,125 C KATWARIA SARAI MAIN ROAD DELHI 110016,DELHI,DELHI,DELHI,9213020540
3896,ICICI BANK LIMITED,ICIC0004110,KUKSHI,ICICI BANK LTD OPP GAYATRI SAROVAR DHAR CHIKHALDA MARG NEAR BUS STAND KUKSHI M P,DHAR,DHAR,MADHYA PRADESH,7471117429
3897,ICICI BANK LIMITED,ICIC0004111,SHIVADI,SHOP NO 1 AND 2 AT SHIVADI POST UGAON TAL NIPHAD DIST NASHIK,NASIK,NASHIK,MAHARASHTRA,0
3898,ICICI BANK LIMITED,ICIC0004112,THILLAI GANGA NAGAR,30 THILLAI GANGA NAGAR 23RD STREET NAGANALLUR CHENNAI 600061,CHENNAI,CHENNAI,TAMIL NADU,0
3899,ICICI BANK LIMITED,ICIC0004114,MADHUBAN CHOWK,FD-1 MAIN MARKET PITAMPURA NEW DELHI-110085,DELHI,DELHI,DELHI,8010399060
3900,ICICI BANK LIMITED,ICIC0004115,NOIDA,SHOP NO LGF-8 AND 9 UGF-9 AND 10 PLOT NO-GH01 SECTOR-121 NOIDA-201301,GAUTAM BUDDHA NAGAR,NOIDA,UTTAR PRADESH,9716786244
3901,ICICI BANK LIMITED,ICIC0004116,KOTHAPALLI,ICICI BANK LTD D NO 2 45 KOTHAPALLI VILLAGE GHANTASALA MANDAL KRISHNA DIST 521133,KRISHNA,KODALI,ANDHRA PRADESH,0
3902,ICICI BANK LIMITED,ICIC0004117,AMBERPETA KURELLAGUDEM,AMBERPETA KURELLAGUDEM D NO 1 71 KURELLAGUDEM AMBERPETA WESTGODAVARI AP 534401,WEST GODAVARI,ELURU,ANDHRA PRADESH,0
3903,ICICI BANK LIMITED,ICIC0004118,ICICI BNAK LTD QADIAN,KHASRA NO 45 R37 HARCHOWAL ROAD QADIAN TEH BATALA DISTT GURDASPUR,GURDASPUR,QADIAN,PUNJAB,0
3904,ICICI BANK LIMITED,ICIC0004119,ARNIWALA SHEIKH SUBHANA,ICICI BANK LTD OPP HP PETROL PUMP MALOUT FAZILKA ROAD ARNIWALA SHEIKH SUBHANA,FEROZPUR,ARNIWALA SHEIKH SUBHANA,PUNJAB,7696002072
3905,ICICI BANK LIMITED,ICIC0004120,JALGAON PHATA,ICICI BANK LTD GROUND FLOOR SHOP NO 2 RAMRAJYA BUILDING AURANGABAD NASHIK ROAD NIPHAD,NASIK,NIPHAD,MAHARASHTRA,0
3906,ICICI BANK LIMITED,ICIC0004121,BROADWAY,NO 47 PRAKASAM SALAI BROADWAY CHENNAI 600 108,CHENNAI,CHENNAI,TAMIL NADU,9025870626
3907,ICICI BANK LIMITED,ICIC0004122,RAMANTHAPUR,ICICI BANK LTD H NO 2 3 508 1 1 LATEEF NAGAR RAMANTHAPUR HYDERABAD 500013,HYDERABAD,HYDERABAD,TELANGANA,0
3908,ICICI BANK LIMITED,ICIC0004123,GANNAVARAM,ICICI BANK LIMITED BOPPANAS TBR CENTRAL GANDHI BOMMA CENTER GANNAVARAM KRISHNA DISRTICT AP 521101,KRISHNA,GANNAVARAM,ANDHRA PRADESH,9014424287
3909,ICICI BANK LIMITED,ICIC0004124,NALKHEDA,ICICI BANK LTD JAWAHAR MARG NALKHEDA PINCODE 465445 DIST-AGAR MALWA MADHYA PRADESH,SHAJAPUR,NALKHERA,MADHYA PRADESH,9039449184
3910,ICICI BANK LIMITED,ICIC0004125,CHITTAPUR,TMC NO 1 160 2 OPP TEHSIL OFFICE STATION ROAD DIST KALBURGI CHITTAPUR 585211,GULBARGA,GULBARGA,KARNATAKA,0
3911,ICICI BANK LIMITED,ICIC0004126,VELUR,"ICICI BANK LTD,NO 110,KADAI STREET,SULTHANPET,VELUR,NAMAKKAL -638182",NAMAKKAL,NAMAKKAL,TAMIL NADU,9952405500
3912,ICICI BANK LIMITED,ICIC0004127,JAMMIKUNTA,H.NO 2 5 94 MIG 12 HOUSEING BOARD COLONY JAMMIKUNTA KARIMNAGAR TELANGANA 505122,JAMMIKUNTA,JAMMIKUNTA,TELANGANA,0
3913,ICICI BANK LIMITED,ICIC0004128,HANUMAN JUNCTION,H NO4 109 110 VIJAYAWADA ROAD OPP RTC BUS STAND BAPULAPADU HANUMAN JUNCTION DIST KRISHNA,KRISHNA,KRISHNA,ANDHRA PRADESH,8656
3914,ICICI BANK LIMITED,ICIC0004129,DHANGAON,BTIGHGOHIIMRIITTHRMP,HARDA,RAHETGAON,MADHYA PRADESH,0
3915,ICICI BANK LIMITED,ICIC0004130,ALAMPUR,ICICI BANK LTD VILLAGE ALAMPUR THE TIMARNI DISTT HARDA M P,HARDA,SODALPUR,MADHYA PRADESH,0
3916,ICICI BANK LIMITED,ICIC0004131,BHISHAMPUR,ICICI BANK LTD VILLAGE BHISHAMPUR TEHSIL AMARPATAN DIST SATNA MADHYA PRADESH 485778,SATNA,AMARPATAN,MADHYA PRADESH,9713063569
3917,ICICI BANK LIMITED,ICIC0004132,NAVLAKH UMBRE,ICICI BANK LTD CTS NO 407 A/P NAVLAKH UMBRE TALUKA MAVAL DIST PUNE 410507,PUNE,PUNE,MAHARASHTRA,9595942793
