,BANK NAME,IFSC,OFFICE,ADDRESS,DISTRICT,CITY,STATE,PHONE
1235,ICICI BANK LIMITED,ICIC0001305,TADPATRI ANDHRA PRADESH,"ICICI BANK LTD., NO.4-318, LAXMI TOWER, SRI RAMULUPETA, ANNAPURNA TALKIES ROAD, TADIPATRI, ANANTAPUR - 515411, ANDHRA PRADESH",ANANTAPUR,TADPATRI,ANDHRA PRADESH,0
1236,ICICI BANK LIMITED,ICIC0001306,"PUTTAPARTHI, ANDHRA PRADESH","ICICI BANK LTD., DOOR NO.48/63, KOTA SATYAM COMLPEX, OPP.GENERAL HOSPITAL, PUTTAPARTHI - 515134,ANANTAPUR DIST., ANDHRA PRADESH.",ANANTAPUR,PUTTAPARTHI,ANDHRA PRADESH,0
1237,ICICI BANK LIMITED,ICIC0001307,"KARIMNAGAR, ANDHRA PRADESH","ICICI BANK LTD,D.NO.7-2-1125, OPP. TNGO COMPLEX, MANKAMMATHOTA, KARIMNAGAR - 505002, ANDHRA PRADESH.",KARIMNAGAR,KARIMNAGAR,ANDHRA PRADESH,0
1238,ICICI BANK LIMITED,ICIC0001308,KHAMMAM,"ICICI BANK LTD., DOOR NO. 2-3-105, GANDHI CHOWK, KHAMMAM - 507 003, KHAMMAM DIST., ANDHRA PRADESH.",KHAMMAM,KHAMMAM,ANDHRA PRADESH,0
1239,ICICI BANK LIMITED,ICIC0001309,MACHILIPATNAM,ICICI BANK LTD- D NO : 25-245/246- KENNEDY ROAD- JAGANNATHAPURAM- ANDHRA PRADESH 521001,KRISHNA,MACHILIPATNAM,ANDHRA PRADESH,0
1240,ICICI BANK LIMITED,ICIC0001310,"YERRAGUNTLA, ANDHRA PRADESH","ICICI BANK LTD., 3-133/1TO 3 - 133/4, SANTA MARKET, YERRAGUNTLA - 518510, TALUKA - SIRVELLA, KURNOOL DIST., AP",KURNOOL,YERRAGUNTLA,ANDHRA PRADESH,0
1241,ICICI BANK LIMITED,ICIC0001311,WANAPARTHY,ICICI BANK LTD- D NO : 38-54/3- DEPOT ROAD- VALLABH NAGAR- WANAPARTHY- ANDHRA PRADESH 509103,MAHBUBNAGAR,WANAPARTHI,ANDHRA PRADESH,0
1242,ICICI BANK LIMITED,ICIC0001312,SANGAREDDY,ICICI BANK LIMITED- SURVEY NO 13-A- OPP.INTEGRATED COLLECTORATE-MAIN ROAD- SANGAREDDY. 502 295,MEDAK,SANGAREDDY,ANDHRA PRADESH,0
1243,ICICI BANK LIMITED,ICIC0001313,Sriganganagar - Housing Board Colony,"3/19, Housing Board Colony, Opp. Sidana Lab, Sriganganagar - 335001, Rajasthan",PRAKASAM,ONGOLE,ANDHRA PRADESH,0
1244,ICICI BANK LIMITED,ICIC0001314,"L.B.NAGAR, ANDHRA PRADESH","ICICI BANK LTD., 3-12-64, BALAJI NAGAR, NEAR BIG BAZAR, MANSOORBAD, L.B.NAGAR - 500068, RANGAREDDY DIST., ANDHRA PRADESH.",RANGAREDDY,L.B.NAGAR,ANDHRA PRADESH,0
1245,ICICI BANK LIMITED,ICIC0001315,"MALKAJGIRI, ANDHRA PRADESH","ICICI BANK LTD., 1-29/1/1, 1-29/2/1, 1-29/1/2, 1-29/1/1A AND 1-29/1/6, MALKAJGIRI - 500047, RANGAREDDY DIST., ANDHRA PRADESH.",RANGAREDDY,MALKAJGIRI,ANDHRA PRADESH,0
1246,ICICI BANK LIMITED,ICIC0001316,"RAJENDRANAGAR, ANDHRA PRADESH","ICICI BANK LTD., 4-3-143/A, BPR TOWERS, ATTAPUR, RAJENDRANAGAR - 500048, RANGAREDDY DIST., ANDHRA PRADESH.",RANGAREDDY,RAJENDRANAGAR,ANDHRA PRADESH,0
1247,ICICI BANK LIMITED,ICIC0001317,"SERI-LINGAMPALLY, ANDHRA PRADESH","ICICI BANK LTD., 11/A, HUDA TRADE CENTRE, NALLAGANDLA, SERI-LINGAMPALLY - 500019, RANGAREDDY DIST., ANDHRA PRADESH",RANGAREDDY,SERI-LINGAMPALLY,ANDHRA PRADESH,0
1248,ICICI BANK LIMITED,ICIC0001318,"KAPRA, ANDHRA PRADESH","ICICI BANK LTD., PLOT NO. 13, H.NO. 10-29/13, SUBHASH NAGAR, OPP :JUNA NAGAR, KUSHAIGUDA, KAPRA -500062, RANGAREDDY DIST., ANDHRA PRADESH.",RANGAREDDY,KUSHAIGUDA,ANDHRA PRADESH,0
1249,ICICI BANK LIMITED,ICIC0001319,"NAD KOTHA ROAD, VISAKHAPATNAM, ANDHRA PRADESH","ICICI BANK LTD., DOOR NO. 58, SYAMALA ARCADE, BUTCHIRAJU PALAM, NAD KOTHA ROAD, VISAKHAPATNAM- 530027, VISAKHAPATNAM DIST., AP",VISHAKHAPATNAM,VISAKHAPATNAM,ANDHRA PRADESH,0
1250,ICICI BANK LIMITED,ICIC0001320,"UPPAL KALAN, ANDHRA PRADESH","ICICI BANK LTD., PLOT NO. 2 & 3, SURVEY NO. 37, PIRJADIGUDA, UPPALKALAN- 500039, RANGA REDDY DIST., ANDHRA PRADESH.",RANGAREDDY,UPPAL,ANDHRA PRADESH,0
1251,ICICI BANK LIMITED,ICIC0001321,"MANGALDOI, ASSAM","ICICI BANK LTD., WARD NO.3, LNB ROAD, MANGALDOI TOWN, DARRANG, MANGALDOI - 784125, ASSAM",DARRANG,MANGALDAI,ASSAM,0
1252,ICICI BANK LIMITED,ICIC0001322,"DHUBRI, ASSAM","ICICI BANK LTD., WARD NO. 2, T R PHUKAN RD, NEAR MAIN BAZAR, DHUBRI -783301, DHUBRI  DIST., ASSAM",DHUBRI,DHUBRI,ASSAM,0
1253,ICICI BANK LIMITED,ICIC0001323,"GOLAGHAT,  ASSAM","ICICI BANK LTD., J B COMPLEX, HOSPITAL ROAD , TOKANI CIRCLE , GOLAGHAT - 785621, GOLAGHAT  DIST., ASSAM.",GOLAGHAT,GOLAGHAT,ASSAM,0
1254,ICICI BANK LIMITED,ICIC0001324,"NORTH LAKHIMPUR, ASSAM","ICICI BANK LTD., D.M.COMPLEX, C.D RD, NH - 52, NORTH LAKHIMPUR -787001, LAKHIMPUR DIST., ASSAM.",LAKHIMPUR,NORTH LAKHIMPUR,ASSAM,0
1255,ICICI BANK LIMITED,ICIC0001325,AURANGABAD - BIHAR,"ICICI BANK LTD., K.P. AGARWAL COMPLEX, M.G ROAD, NEW AREA, AURANGABAD- 824101, AURANGABAD DIST., BIHAR.",AURANGABAD,AURANGABAD,BIHAR,0
1256,ICICI BANK LIMITED,ICIC0001326,"KATIHAR, BIHAR","ICICI Bank Ltd., Vaidyanath Complex, M.G.Road, Near Shahid Chowk, Katihar Katihar Dist., Bihar. - 854105",KATIHAR,KATIHAR,BIHAR,0
1257,ICICI BANK LIMITED,ICIC0001327,"LAKHISARAI NAYA BAZAR, BIHAR","ICICI BANK LTD., NAYA BAZAR, LAKHISARAI - 811311, BIHAR",LAKHISARAI,LAKHISARAI,BIHAR,0
1258,ICICI BANK LIMITED,ICIC0001328,"MADHUBANI, BIHAR","ICICI BANK LTD., KUMAR ENCLAVE, NEAR SURI HIGH SCHOOL, CHOWK, MADHUBANI - 847211, MADHUBANI DIST., BIHAR.",MADHUBANI,MADHUBANI,BIHAR,0
1259,ICICI BANK LIMITED,ICIC0001329,"MUNGER, BIHAR","ICICI BANK LTD., BMLJ HOUSE, 169, BARA BAZAR, MUNGER ┬û 811201, MUNGER DIST., BIHAR.",MUNGER,MUNGHYR,BIHAR,0
1260,ICICI BANK LIMITED,ICIC0001330,"CIVIL COURT - MUZAFFARPUR, BIHAR","ICICI BANK LTD., SHUKLA MARKET, KHUDIRAM BOSE ROAD, NEAR CIVIL COURT, MUZAFFARPUR - 842001, MUZAFFARPUR DIST., BIHAR.",MUZAFFARPUR,MUZAFFARPUR,BIHAR,0
1261,ICICI BANK LIMITED,ICIC0001331,"BIHAR SHARIF, BIHAR","ICICI BANK LTD., LAXMI PAPER MART, A.R.COMPLEX, BHARAOPER, BIHAR SHARIF - 803101, NALANDA DIST., BIHAR.",NALANDA,BIHAR SHARIF,BIHAR,0
1262,ICICI BANK LIMITED,ICIC0001332,"NAWADA, BIHAR","ICICI BANK LTD., PRASAD BIGHA, MAIN ROAD, NAWADA - 805110, NAWADA DIST., BIHAR",NAWADA,NAWADA,BIHAR,0
1263,ICICI BANK LIMITED,ICIC0001333,"ANISHABAD PATNA, BIHAR","ICICI BANK LTD., HULLAS BIHAR, OPP. POLICE COLONY, ANISHABAD, PATNA - 800002, PATNA DIST., BIHAR",PATNA,PATNA,BIHAR,0
1264,ICICI BANK LIMITED,ICIC0001334,"MOTIHARI, BIHAR","ICICI BANK LTD., HAZAR JYOTI COMPLEX, BANK ROAD, MOTIHARI - 845404, DIST. PURBI CHAMPARAN, BIHAR.",PURBI CHAMPARAN,MOTIHARI,BIHAR,0
1265,ICICI BANK LIMITED,ICIC0001335,SASARAM BIHAR,"ICICI BANK LTD.,HASNU MARKET COMPLEX, GT ROAD, SASARAM, ROHTAS, BIHAR - 821115",ROHTAS,SASARAM,BIHAR,0
1266,ICICI BANK LIMITED,ICIC0001336,"SAMASTIPUR, BIHAR","ICICI BANK LTD., NEW MARKET STATION ROAD, NEAR H.P.GHOSH PETROL PUMP, SAMASTIPUR - 848101, SAMASTIPUR DIST., BIHAR",SAMASTIPUR,SAMASTIPUR,BIHAR,0
1267,ICICI BANK LIMITED,ICIC0001337,"SITAMARHI, BIHAR","ICICI BANK LTD., DS TOWER, NEAR SANKAR CINEMA HALL, SITAMARHI - -843302, SITAMARHI DIST., BIHAR.",SITAMARHI,SITAMARHI,BIHAR,0
1268,ICICI BANK LIMITED,ICIC0001338,SIWAN,"ICICI BANK LTD., BABUNIA CHOWK, RAJENDRA PATH ,SIWAN, BIHAR- 841226",SIWAN,SIWAN,BIHAR,0
1269,ICICI BANK LIMITED,ICIC0001339,"HAJIPUR, BIHAR","ICICI BANK LTD., CHOUDHARI CENTER, RAJENDRA CHOWK, MARAI ROAD, HAJIPUR - 844101, VAISHALI DIST., BIHAR.",VAISHALI,HAJIPUR,BIHAR,0
1270,ICICI BANK LIMITED,ICIC0001340,"CHANDIGARH SECTOR 19, CHANDIGARH","ICICI BANK LTD., SCO 23, SECTOR 19C , CHANDIGARH-160019",CHANDIGARH,CHANDIGARH,CHANDIGARH,0
1271,ICICI BANK LIMITED,ICIC0001341,"SECTOR 34A, CHANDIGARH","ICICI BANK LTD., SCO 218-219, SECTOR 34-A, CHANDIGARH ┬û 160034.",CHANDIGARH,CHANDIGARH,CHANDIGARH,0
1272,ICICI BANK LIMITED,ICIC0001342,"CHANDIGARH SECTOR 26, CHANDIGARH","ICICI BANK LTD., SHOWROOM NO 45, SECTOR 26 ,MADHYA MARG, CHANDIGARH -160026",CHANDIGARH,CHANDIGARH,CHANDIGARH,0
1273,ICICI BANK LIMITED,ICIC0001343,"CHANDIGARH SECTOR 17, CHANDIGARH","ICICI BANK LTD., SCO 99-100,GROUND FLOOR, SECTOR 17 B,CHANDIGARH-160017",CHANDIGARH,CHANDIGARH,CHANDIGARH,0
1274,ICICI BANK LIMITED,ICIC0001344,Bilaspur - Goal Bazaa,"ICICI Bank Ltd, Naveen Plaza, Main Road, Telipara, Bilaspur Bilaspur Dist., Chhattisgarh 495001",BILASPUR,BILASPUR,CHANDIGARH,0
1275,ICICI BANK LIMITED,ICIC0001345,Bhatapara,"ICICI Bank Ltd, Shankarpara Ward, Jaistambh Chowk, Bhatapara Raipur Dist., Chhattisgarh. 493118",RAIPUR,BHATAPARA,CHANDIGARH,0
1276,ICICI BANK LIMITED,ICIC0001346,Raipur - Panchbadi Naka,"ICICI Bank Ltd, Arihant Complex, Shop No. 31/32, Opp. Ring Rd., Raipur Chhattisgarh 492001",RAIPUR,RAIPUR,CHANDIGARH,0
1277,ICICI BANK LIMITED,ICIC0001347,Raipur-Pandri,"ICICI Bank Ltd, Mukt Prayag Complex, Jeevan Bima Marg, Pandri, Raipur Raipur Dist., Chattisgarh 492004",RAIPUR,PANDRI TARAI,CHANDIGARH,0
1278,ICICI BANK LIMITED,ICIC0001348,Raipur - Choubey Colony,"ICICI Bank Ltd, Mahavir Suraj Kunj, Plot No.1, South Avenue, Choubey Colony, Raipur Raipur Dist., Chhattisgarh. 492010",RAIPUR,RAIPUR,CHANDIGARH,0
1279,ICICI BANK LIMITED,ICIC0001349,Raipur - Jaistambh Chowk,"ICICI Bank Ltd, Behind Head Post Office, Jaistambh Chowk, Raipur, Raipur Dist., Chhattisgarh.492001",RAIPUR,RAIPUR,CHANDIGARH,0
1280,ICICI BANK LIMITED,ICIC0001350,"DIU, DAMAN & DIU","ICICI BANK LTD 38, GANDHI HOUSE, BUNDER CHOWK DIU 362520 GUJARAT",DIU,DIU,DAMAN AND DIU,0
1281,ICICI BANK LIMITED,ICIC0001351,"NEW DELHI - LONI ROAD, DELHI","ICICI BANK LTD., 602/4-A, RAMNAGAR LONI ROAD, SHAHDARA, DELHI -  110032",DELHI,DELHI,DELHI,0
1282,ICICI BANK LIMITED,ICIC0001352,"NEW DELHI OUTER CIRCLE CP, DELHI","ICICI BANK LTD., M-45, OUTER CIRCLE, CONNAUGHT PLACE, NEW DELHI- 110001",DELHI,DELHI,DELHI,0
1283,ICICI BANK LIMITED,ICIC0001353,"NEW DELHI - ITL TOWER, DELHI","ICICI BANK LTD., G-20-21 PP TOWER NETAJI SHUBHASH PALCE PITAMPURA -110034, NEW DELHI",DELHI,DELHI,DELHI,0
1284,ICICI BANK LIMITED,ICIC0001354,"NEW DELHI, DELHI","ICICI BANK LTD., E-1, VIDEOCON TOWERS, JHANDEWALAN EXTENSION, RANI JHANSI ROAD, NEW DELHI- 110055",DELHI,DELHI,DELHI,0
1285,ICICI BANK LIMITED,ICIC0001355,"NEW DELHI - DURGAPURI CHOWK, DELHI","ICICI BANK LTD., B-10 WEST JYOTI NAGAR, NEAR DURGAPURI CHOWK, SHAHADRA, DELHI- 110094",DELHI,DELHI,DELHI,0
1286,ICICI BANK LIMITED,ICIC0001356,"NEW DELHI - SADAR THANA, DELHI","ICICI BANK LTD., 5326/31, GROUND FLOOR, MAIN SADAR THANA ROAD, NEW DELHI ┬û 110006",DELHI,DELHI,DELHI,0
1287,ICICI BANK LIMITED,ICIC0001357,NEW DELHI - MOHAN CO-OP IND. ESTATE,"ICICI BANK LTD., BLOCK - B -1, PLOT A-12, MOHAN CO -OPERATIVE MATHURA ROAD -110044, NEW DELHI",DELHI,DELHI,DELHI,0
1288,ICICI BANK LIMITED,ICIC0001358,NEW DELHI ┬û REGHARPURA NCR,"ICICI BANK LTD., 5437 ARYA SAMAJ ROAD,REGHARPURA, KAROL BAGH, NEW DELHI-1100005",DELHI,DELHI,DELHI,0
1289,ICICI BANK LIMITED,ICIC0001359,"DELHI BARAKHAMBA, DELHI","ICICI BANK LTD, G-4,19 ARUNACHAL BUILDING, BARAKHAMBA ROAD, NEW DELHI -110001",DELHI,DELHI,DELHI,0
1290,ICICI BANK LIMITED,ICIC0001360,"NEW DELHI - BHAJANPURA, DELHI","ICICI BANK LTD., B-45/6, MAIN WAZIRABAD ROAD, BHAJANPURA, DELHI- 110053",DELHI,DELHI,DELHI,0
1291,ICICI BANK LIMITED,ICIC0001361,"BICHOLIM, GOA","ICICI BANK LTD, SHOP NO.10 & 11, TRINITY APT., NEAR BANK OF INDIA, BICHOLIM MARKET, BICHOLIM, GOA- 403504",NORTH GOA,BICHOLIM,GOA,0
1292,ICICI BANK LIMITED,ICIC0001362,"CALANGUTE, GOA","ICICI BANK LTD., LITANGINI HOUSE, H.NO.261A-7, OPP. ROYAL FOODS, NEAR NILAMDE GRAND HOTEL, CALANGUTE - 403516, NORTH GOA DIST., GOA.",NORTH GOA,CALANGUTE,GOA,0
1293,ICICI BANK LIMITED,ICIC0001363,"PILERNE, GOA","ICICI BANK LTD., SHREE, PLOT NO.121, PDA COLONY, OPP. TARUN BHARAT, PRINTING PRESS, NH 17, PILERNE, PORVARI, GOA- 403521",NORTH GOA,PILERNA,GOA,0
1294,ICICI BANK LIMITED,ICIC0001364,"PANAJI - PATTO PLAZA, GOA","ICICI BANK LTD., SHOPS NO.2 & 3, GR.FLR., SESA GHOR, PATTO PLAZA, PANAJI, GOA- 403001",NORTH GOA,PANAJI,GOA,0
1295,ICICI BANK LIMITED,ICIC0001365,CHINCHINIM,ICICI BANK LTD- H NO. 296/1- SECREA VADDO- CHINCHINIM- GOA 403715,SOUTH GOA,CHINCHINIM,GOA,0
1296,ICICI BANK LIMITED,ICIC0001366,"ARLEM-MARGAO, GOA","ICICI BANK LTD., SHOP NO. 25 & 26, CROSS ROAD AVENUE, NEXT TO GOA BOTTLING FACTORY, EASTERN EXPRESS BYPASS, ARLEM, MARGAO - 403601, SOUTH GOA DIST., GOA.",SOUTH GOA,MARGAO,GOA,0
1297,ICICI BANK LIMITED,ICIC0001367,"AHMEDABAD C G ROAD, GUJARAT","ICICI BANK LTD., SHOP NO.4, SUKAN BUSINESS CENTERM NEAR FARIDEAL HOUSE, NAVRANGPURA, OFF CG ROAD, AHMEDABAD - 380009, GUJARAT",AHMADABAD,AHMEDABAD,GUJARAT,0
1298,ICICI BANK LIMITED,ICIC0001368,"RELIEF ROAD, AHMEDABAD, GUJARAT","ICICI BANK LTD., KOTY'S BUILDING, NR. BHAGWATI KRUPA EMPORIUM, GHEEKANTA CROSS ROADS, RELIEF ROAD, AHMEDABAD - 380001, AHMEDABAD DIST., GUJARAT.",AHMADABAD,AHMEDABAD,GUJARAT,0
1299,ICICI BANK LIMITED,ICIC0001369,"GANDHI ROAD-AHMEDABAD, GUJARAT","ICICI BANK LTD., 1760, SARASWAT SADAN, OPP. BALA HANUMAN MANDIR, GANDHI ROAD, AHMEDABAD-380001, AHMEDABAD DIST., GUJARAT.",AHMADABAD,AHMEDABAD,GUJARAT,0
1300,ICICI BANK LIMITED,ICIC0001370,SANAND GUJARAT,"Ground Floor 7, Shiv Krupa Society, Sarkhej Viram Gam Highway, Sanand, Dist: Ahmedabad, Gujarat - 382110",AHMADABAD,SANAND,GUJARAT,0
1301,ICICI BANK LIMITED,ICIC0001371,"THALTEJ-SILAJ ROAD, THALTEJ","ICICI BANK LTD., SILVER SQUARE, SHOP NO.B/2, THALTEJ-SILAJ ROAD, THALTEJ - 380012,  AHMEDABAD DIST., GUJARAT.",AHMADABAD,THALTAJ,GUJARAT,0
1302,ICICI BANK LIMITED,ICIC0001372,"DHARMAJ, GUJARAT","ICICI BANK LTD., 2 MOHAN CHOWK, DHARMAJ-388430, TALUKA-PETLAD, DIST-ANAND, GUJARAT.",ANAND,DHARMAJ,GUJARAT,0
1303,ICICI BANK LIMITED,ICIC0001373,"PETLAD, GUJARAT","ICICI Bank Ltd., Majoor Kalyan Trust, Majoor Sevalaya, Station Road, Petlad, Dist. Anand, Gujarat - 388450",ANAND,PETLAD,GUJARAT,0
1304,ICICI BANK LIMITED,ICIC0001374,DAHEJ,"ICICI BANK LTD., MARUTI COMPLEX- NR. IBP PETROL PUMP- DAHEJ- DIST. BHARUCH 392130",BHARUCH,DAHEJ,GUJARAT,0
1305,ICICI BANK LIMITED,ICIC0001375,BOTAD,"ICICI Bank Ltd,Ground Floor, Kanchan Complex, Botad, Gujarat  364710",BHAVNAGAR,BOTAD,GUJARAT,0
1306,ICICI BANK LIMITED,ICIC0001376,"MOTIKAVDI - 2, GUJARAT","ICICI BANK LTD., RELIANCE A1 PLAZA, NEAR MATERIALGATE, MOTIKAVDI - 361140, JAMNAGAR DIST., GUJARAT.",JAMNAGAR,JAMNAGAR,GUJARAT,0
1307,ICICI BANK LIMITED,ICIC0001377,"RAJPIPLA, GUJARAT","ICICI BANK LTD., ""SHREE RANG ASHISH"", GROUND FLOOR, STATION ROAD, OPPOSITE RADHA KRISHNA TEMPLE, RAJPIPLA - 393145 ,GUJARAT",NARMADA,RAJPIPLA,GUJARAT,0
1308,ICICI BANK LIMITED,ICIC0001378,"VADINAR, GUJARAT","ICICI Bank Ltd., Ground Floor, Essar Oil Ltd, RAB Building, PO Box No- 24, At Post Khambaliya, Vadinar - 361305, Gujarat",JAMNAGAR,VADINAR,GUJARAT,0
1309,ICICI BANK LIMITED,ICIC0001379,"KESHOD, GUJARAT","ICICI BANK LTD., NEAR POST OFFICE, OPP. HIRA PANNA COMPLEX, JUNAGADH VERAVAL HIGHWAY, KESHOD - 362220, JUNAGADH DIST., GUJARAT.",JUNAGADH,KESHOD,GUJARAT,0
1310,ICICI BANK LIMITED,ICIC0001380,VERAVAL,"ICICI Bank Ltd., Ground Floor, Vinayak Plaza, Tower Chowk, Veraval, Gujrat - 362265",JUNAGADH,VERAVAL,GUJARAT,0
1311,ICICI BANK LIMITED,ICIC0001381,"MANDVI, GUJARAT","ICICI BANK LTD, NR. KALYAN COMPLEX, S T ROAD,MANDVI, KUTCH : 370465",KACHCHH,MANDVI,GUJARAT,0
1312,ICICI BANK LIMITED,ICIC0001382,BILIMORA,"ICICI BANK LTD., GROUND FLOOR, BHAIRAVNATH COMPLEX, J.C PARK, MAHADEV NAGAR, BILIMORA, TALUKA. GANDEV, DIST. NAVSARI, PIN CODE - 396321.",NAVSARI,BILIMORA,GUJARAT,0
1313,ICICI BANK LIMITED,ICIC0001383,"RAJKOT PALACE ROAD, GUJARAT","ICICI BANK LTD., 8 VARDHAMAN NAGAR CORNER, PALACE ROAD, RAJKOT - 360001, GUJARAT",RAJKOT,RAJKOT,GUJARAT,0
1314,ICICI BANK LIMITED,ICIC0001384,"KOSAMBA, GUJARAT","ICICI BANK LTD., SHOP NO.2 & 3, SAI VILLA APARTMENT, OPP.TARSALI NAGAR, BURAO MANDIR ROAD, KOSAMBA - 394120, SURAT DIST., GUJARAT.",SURAT,KOSAMBA,GUJARAT,0
1315,ICICI BANK LIMITED,ICIC0001385,"UDHANA, SURAT","ICICI BANK LTD., CROSS CORNER, OPP.SILICON SHOPPER, UDHANA MAIN ROAD, UDHANA, SURAT-394210, SURAT DIST., GUJARAT.",SURAT,SURAT,GUJARAT,0
1316,ICICI BANK LIMITED,ICIC0001386,"SURAT RANDER, GUJARAT","ICICI BANK LTD., HARI OM COMPLEX, RUSHABH TOWER, CROSS ROADS, RANDER, SURAT - 395009, SURAT DIST., GUJARAT.",SURAT,SURAT,GUJARAT,0
1317,ICICI BANK LIMITED,ICIC0001387,"TEXTILE MARKET - SURAT, GUJARAT","ICICI BANK LTD., RAGHUNANDAN TEXTILE MARKET, OPP. RATHI PALACE, RING ROAD, SURAT - 395002, SURAT DIST., GUJARAT.",SURAT,SURAT,GUJARAT,0
1318,ICICI BANK LIMITED,ICIC0001388,"SURAT - GHOD DOD ROAD, GUJARAT","ICICI BANK LTD, SHOP NO. 1-2, SURYAKIRAN APT., GHOD DOD ROAD, SURAT ┬û 395007, GUJARAT",SURAT,SURAT,GUJARAT,0
1319,ICICI BANK LIMITED,ICIC0001389,"SURAT - PUNA KUMBHARIYA, GUJARAT","ICICI Bank Ltd., 11-12, Times Square, Near Landmark Empire, Vakilwadi, Puna Kumbhariya, Surat - 395010, Gujarat",SURAT,SURAT,GUJARAT,0
1320,ICICI BANK LIMITED,ICIC0001390,"WAIDHAN, MADHYA PRADESH","ICICI BANK LTD., KANHA COMPLEX, TALI PULIA, MAIN ROAD, WAIDHAN- 486886, MADHYA PARDESH",SIDHI,WAIDHAN,MADHYA PRADESH,0
1321,ICICI BANK LIMITED,ICIC0001391,MAINPURI UTTAR PRADESH,"ICICI BANK LTD., HOUSE NO.1252/199, 1252/200 AND 1252/200/1, NEAR SHANKAR MILL, UTTARI CHHAPATTI, STATION ROAD, MAINPURI - 205001, UTTAR PRADESH",MAINPURI,MAINPURI,UTTAR PRADESH,0
1322,ICICI BANK LIMITED,ICIC0001392,"SOLAPUR - PARK CHOWK, MAHARASHTRA","ICICI BANK LTD., INDRA BHUVAN, HUTUATMA SMARAK MANDIR, NEAR SOLAPUR MUNICIPAL CORPORATION, PARK CHOWK, SOLAPUR - 413001, MAHARASHTRA",SOLAPUR,SOLAPUR,MAHARASHTRA,0
1323,ICICI BANK LIMITED,ICIC0001393,"TAMBARAM, TAMIL NADU","ICICI BANK LTD., NO PLOT NO 27 & 29, AYYASAMY STREET, WEST TAMBARAM, CHENNAI - 600 045",KANCHEEPURAM,TAMBARAM,TAMIL NADU,0
1324,ICICI BANK LIMITED,ICIC0001394,VASAI ROAD (E),"ICICI BANK LTD, HOUSE NO 1138 , GOKHIWARE, VASAI ROAD, EVERSHINE CITY , VASAI (E)- 401208.",THANE,VASAI,MAHARASHTRA,0
1325,ICICI BANK LIMITED,ICIC0001395,VYARA,ICICI BANK LTD. HYPERCITY MALL- NEAR NEW BUS STAND- STATION ROAD- VYARA. 394650,SURAT,VYARA,GUJARAT,0
1326,ICICI BANK LIMITED,ICIC0001396,"VADODARA - NEW LEHRIPURA ROAD, GUJARAT","ICICI BANK LTD., CITY CENTER, GROUND FLOOR, NEAR NYAY MANDIR, OPPOSITE LAL COURT, NEW LEHRIPURA ROAD, VADODARA - 390001, GUJARAT",VADODARA,VADODARA,GUJARAT,0
1327,ICICI BANK LIMITED,ICIC0001397,"UMBERGOAN, GUJARAT","ICICI BANK LTD., M.H.VARMA INDUSTRIES, GIDC, PLOT NO.210, UMBERGOAN - 396171, SUB.DIST.PARDI, DIST.VALSAD, GUJARAT.",VALSAD,UMBERGAON,GUJARAT,0
1328,ICICI BANK LIMITED,ICIC0001398,"AMBALA CANTT, HARYANA","ICICI BANK LTD, SHOP NO 14/15/86, GREEN PARK, GULATI MARKET, MAHESH NAGAR, AMBALA CANTT, HARYANA ┬û 133001",AMBALA,AMBALA CANTT.,HARYANA,0
1329,ICICI BANK LIMITED,ICIC0001399,"TADONG, SIKKIM","ICICI BANK LTD., CONVOY GROUND, TADONG BAZAR, GANGTOK, SIKKIM - 737102, SIKKIM",EAST SIKKIM,TADONG,SIKKIM,0
1330,ICICI BANK LIMITED,ICIC0001400,"SEC-29,FARIDABAD, HARYANA","ICICI BANK LTD., SCOF NO -56 SEC-29 SHOPPING CENTER URBAN STATE FARIDABAD-121008 HARYANA",FARIDABAD,FARIDABAD,HARYANA,0
1331,ICICI BANK LIMITED,ICIC0001401,"FARIDABAD BALLABHGARH, HARYANA","ICICI BANK LTD., 21/5 MILESTONE MATHURA ROAD, AGGARWAL WOOD INDUSTRIES, BALLABGARH, FARIDABAD, HARYANA- 121004",FARIDABAD,BALLABGARH,HARYANA,0
1332,ICICI BANK LIMITED,ICIC0001402,"JHAJJAR, HARYANA","Jai Durge Building, Rohtak Road, Near Rajotia Hospital, Jhajjar, Haryana - 124104",JHAJJAR,JHAJJAR,HARYANA,0
1333,ICICI BANK LIMITED,ICIC0001403,"VISNAGAR, GUJARAT","ICICI BANK LTD., G/F SHOP NO 11 TO 15, SPAN CHANDAN MALL, STATION ROAD, VISNAGAR - 384315 , GUJARAT.",MAHESANA,VISNAGAR,GUJARAT,0
1334,ICICI BANK LIMITED,ICIC0001404,"PANCHKULA SECTOR 8, HARYANA","ICICI BANK LTD., SCO 412, SECTOR 8, PANCHKULA, HARYANA - 134109",PANCHKULA,PANCHKULA,HARYANA,0
1335,ICICI BANK LIMITED,ICIC0001405,"KUNDLI, HARYANA","ICICI BANK LTD , 31 MILESTONE, BEHIND CHOPRA FILLING STATION, KUNDLI, HARYANA-131028",SONIPAT,KUNDLI,HARYANA,0
1336,ICICI BANK LIMITED,ICIC0001406,"KANGRA, HIMACHAL PRADESH","ICICI BANK LTD., DASTAK BUILDING, NEAR TEHSIL CHOWK, DHARAMSHALA ROAD, KANGRA ┬û 176001, KANGRA DIST., HIMACHAL PRADESH.",KANGRA,KANGRA,HIMACHAL PRADESH,0
1337,ICICI BANK LIMITED,ICIC0001407,PAONTA SAHIB,ICICI BANK LTD.- 99- WARD NO. 6- MAIN MARKET ROAD- PAONTA SAHIB- HIMACHAL PRADESH 173025,SIRMAUR,PAONTA SAHIB,HIMACHAL PRADESH,0
1338,ICICI BANK LIMITED,ICIC0001408,"KATRA, JAMMU & KASHMIR","ICICI BANK LTD., BHAWANI'S PARADISE HOTEL, KHASRA NO.50, JAMMU ROAD, KATRA, JAMMU & KASHMIR- 182301",JAMMU,JAMMU,JAMMU AND KASHMIR,0
1339,ICICI BANK LIMITED,ICIC0001409,"LONAND,  MAHARASHTRA","ICICI BANK LTD., BHOSALE ARCADE, SHOP NO.1, TEHSIL KHANDALA, AT POST LONAND - 415521, SATARA DIST.,  MAHARASHTRA",SATARA,LONAND,MAHARASHTRA,0
1340,ICICI BANK LIMITED,ICIC0001410,"CHIRKUNDA, JHARKHAND","ICICI BANK LTD., HARYANA COLONY, G.T.ROAD, CHIRKUNDA -828202, DIST- DHANBAD, JHARKHAND.",DHANBAD,CHIRKUNDA,JHARKHAND,0
1341,ICICI BANK LIMITED,ICIC0001411,"SARAIDHELA  ROAD- DHANBAD, JHARKHAND","ICICI BANK LTD., SHRI SHYAM BHAWAN, SARAIDHELLA ROAD, DHANBAD - 828127, DHANBAD DIST., JHARKHAND.",DHANBAD,DHANBAD,JHARKHAND,0
1342,ICICI BANK LIMITED,ICIC0001412,MANGO JHARKHAND,"ICICI BANK LTD,SHOP NO.2 & 3, AKASH TOWER, NEAR TRANSPORT NAGAR, DIMNA ROAD, MANGO, JAMSHEDPUR, JHARKHAND - 831018",PURBI SINGHBHUM,MANGO,JHARKHAND,0
1343,ICICI BANK LIMITED,ICIC0001413,"MUDHOL, KARNATAKA","ICICI BANK LTD., CDF NO. 4026B, RANN CIRCLE, HUBLI-BIJAPUR ROAD, RUN CIRCLE, MUDHOL-587313, BAGALKOT DIST., KARNATAKA.",BAGALKOTE,MUDHOL,KARNATAKA,0
1344,ICICI BANK LIMITED,ICIC0001414,"BIDADI TOWN, KARNATAKA","ICICI BANK LTD., NO.318-345-1, NALLAGUDDA TANK ROAD, NEAR MAIN BUS STAND, BIDADI TOWN - 562109, RAMANAGAR TALUK, BANGALORE RURAL DISTRICT, KARNATAKA.",BANGALORE RURAL,BIDADI,KARNATAKA,0
1345,ICICI BANK LIMITED,ICIC0001415,"DEVANAHALLI, KARNATAKA","ICICI BANK LTD., SHANKAR BUILDING, KHATA NO.433/135/3, B.B.ROAD, NEAR RTO OFFICE, DEVANAHALLI - 562110, BANGALORE RURAL DIST., KARNATAKA",BANGALORE RURAL,DEVANAHALLI,KARNATAKA,0
1346,ICICI BANK LIMITED,ICIC0001416,CHANNAPATNA KARNATAKA,"ICICI BANK LTD, D NO 1575,1576.1577, AHMEDIYA COMMERCIAL COMPLEX, SHAHI RICE MILL COMPLEX, SATHNOOR, CHANNAPATNA - 571501, KARNATAKA",BANGALORE RURAL,CHANNAPATNA,KARNATAKA,0
1347,ICICI BANK LIMITED,ICIC0001417,"MARATHALLI, BANGALORE, KARNATAKA","ICICI BANK LTD , J P ROYALE , #90/4  OUTER RING ROAD, MARATHAHALLI, BANGALORE - 560037, BANGALORE URBAN DIST., KARNATAKA.",BANGALORE URBAN,MARATHAHALLI,KARNATAKA,0
1348,ICICI BANK LIMITED,ICIC0001418,"JAYANAGAR-BANGALORE, KARNATAKA","ICICI BANK LTD., # 2, 30TH CROSS BANNERGHATTA ROAD, T.BLOCK, EXTN, JAYANAGAR, BANGLORE- 560041, BANGALORE URBAN DIST., KARNATAKA.",BANGALORE URBAN,BANGALORE,KARNATAKA,0
1349,ICICI BANK LIMITED,ICIC0001419,"JALAHALLI - BANGALORE, KARNATAKA","ICICI BANK LTD. AKSHAY COMPLEX, AIR FORCE STATION JALAHALLI EAST, GANGAMMA CIRCLE, BANGALORE - 560014, BANGALORE URBAN DIST., KARNATAKA.",BANGALORE URBAN,BANGALORE,KARNATAKA,0
1350,ICICI BANK LIMITED,ICIC0001420,"JEEVAN BIMA NAGAR-BANGALORE, KARNATAKA","ICICI BANK LTD., 1659 , 10TH MAIN , HAL 3RD STAGE, JEEVAN BIMA NAGAR, MAIN ROAD, BANGALORE - 560075, BANGALORE URBAN DIST., KARNATAKA.",BANGALORE URBAN,BANGALORE,KARNATAKA,0
1351,ICICI BANK LIMITED,ICIC0001421,BANGALORE CUNNINGHAM ROAD KARNATAKA,"ICICI BANK LTD, ICICI BANK LTD. 60, S.R.T ROAD, 11A/ 22, CUNNINGHAM ROAD, BANGALORE - 560042, KARNATAKA.",BANGALORE URBAN,BANGALORE,KARNATAKA,0
1352,ICICI BANK LIMITED,ICIC0001422,BANGALORE MANYATA TECH PARK KARNATAKA,"ICICI BANK LTD. BLOCK 'E', MANYATA - EMBASSY BUSINESS PARK, OUTER RING ROAD, BANGALORE - 560045, KARNATAKA",BANGALORE URBAN,BANGALORE,KARNATAKA,0
1353,ICICI BANK LIMITED,ICIC0001423,"TORANAGALLU, KARNATAKA","ICICI BANK LTD., JINDAL STEEL,  NEW SHOPPING COMPLEX, VIDAYA NAGAR TOWNSHIP, TORANGALLU VILLAGE - 583275, TALUKA SANDUR, DIST BELLARY, KARNATAKA.",BELLARY,TORANAGALLU,KARNATAKA,0
1354,ICICI BANK LIMITED,ICIC0001424,"CHITRADURGA, KARNATAKA","ICICI BANK LTD., HOTEL VIJAY, VIJAY COMPLEX, BD ROAD, CHITRADURGA - 577501, CHITRADURGA, KARNATAKA.",CHITRADURGA,CHITRADURGA,KARNATAKA,0
1355,ICICI BANK LIMITED,ICIC0001425,"DHARWAD - LAKMANAHALLI, KARNATAKA","ICICI BANK LTD., GIRIJA PRISTILE, SHOP.NO.123, RSS NO.32A & 32B, LAKMANAHALLI VILLAGE, DHARWAD - 580004, DHARWAD DIST., KARNATAKA.",DHARWAD,HUBLI-DHARWAD,KARNATAKA,0
1356,ICICI BANK LIMITED,ICIC0001426,HUBLI GOKUL ROAD KARNATAKA,"ICICI BANK LTD , GROUND FLOOR,KALBURGI KATWE DENTITY,CTS NO.4882,GOKUL ROAD ,HUBLI - 580 030 KARNATAKA.",DHARWAD,HUBLI-DHARWAD,KARNATAKA,0
1357,ICICI BANK LIMITED,ICIC0001427,"KOPPAL, KARNATAKA","ICICI BANK LTD., NIRANJAN COMPLEX, NEAR GUNJ CIRCLE, HOSPET ROAD, KOPPAL - 583231, KOPPAL DIST., KARNATAKA.",KOPPAL,KOPPAL,KARNATAKA,0
1358,ICICI BANK LIMITED,ICIC0001428,"INFOSYS, MYSORE KARNATAKA","ICICI BANK LTD., C/O INFOSYS TECHNOLOGIES LTD., (GEC 2 BUILDING),KIADB INDUSTRAIL AREA, HEBBAL - HOOTAGALLI, MYSORE - 570 018, MYSORE DIST., KARNATAKA.",MYSORE,MYSORE,KARNATAKA,0
1359,ICICI BANK LIMITED,ICIC0001429,SIDDHARTHANAGAR-MYSORE,"ICICI BANK LTD., NO.1/B,, BUDDHA MARG, SIDDHARTHA NAGAR, MYSORE - 570011, MYSORE DIST., KARNATAKA.",MYSORE,MYSORE,KARNATAKA,0
1360,ICICI BANK LIMITED,ICIC0001430,"SHAKTINAGAR, RAICHUR","ICICI BANK LTD., PLOT NO.5, LAXMI COMPLEX, SHANTINAGAR LAYOUT, SHAKTINAGAR, RAICHUR-584102, RAICHUR DIST., KARNATAKA.",RAICHUR,SHAKTINAGAR,KARNATAKA,0
1361,ICICI BANK LIMITED,ICIC0001431,"KARKAL, KARNATAKA","ICICI BANK LTD., SRINIVAS, A.S. ROAD, KARKAL - 574104, UDIPI DISTRICT, KARNATAKA",UDIPI,KARKALA,KARNATAKA,0
1362,ICICI BANK LIMITED,ICIC0001432,"SANTHAKATTE - UDUPI, KARNATAKA","ICICI BANK LTD., NAGAPPA COMPLEX, SANTHAKATTE JUNCTION, NH 17, UDUPI - 576105, UDIPI DISTRICT, KARNATAKA.",UDIPI,SANTHEKATE,KARNATAKA,0
1363,ICICI BANK LIMITED,ICIC0001433,"VARKALA, KERALA","ICICI BANK LTD., THUSHARA TOWERS, PUTHENCHANTHA, VARKALA- 695141, THIRUVANANTHAPURAM DIST., KERALA",THIRUVANANTHAPURAM,VARKALA,KERALA,0
1364,ICICI BANK LIMITED,ICIC0001434,"ASHOK NAGAR, MADHYA PRADESH","ICICI BANK LTD, NEW MANDI GATE, NEAR KRISHI UPAJ MANDI, WARD NO-5, SHANTI VIHAR COLONY, DIST-ASHOKNAGAR - 473331",ASHOK NAGAR,ASHOKNAGAR,MADHYA PRADESH,0
1365,ICICI BANK LIMITED,ICIC0001435,"BHIND, MADHYA PRADESH","ICICI BANK LTD., BHARAT COMPLEX, NEAR SBI, LASHKAR ROAD, BHIND -  477001, DIST - BHIND, MADHYA PRADESH",BHIND,BHIND,MADHYA PRADESH,0
1366,ICICI BANK LIMITED,ICIC0001436,"NAGDA, MADHYA PRADESH","ICICI BANK LTD., 136, JAWAHAR MARG, NEAR KOTA PHATAK, NAGDA - 456335, UJJAIN DIST., MADHYA PRADESH.",UJJAIN,NAGDA,MADHYA PRADESH,0
1367,ICICI BANK LIMITED,ICIC0001437,DABRA,ICICI BANK LTD- WARD NO- 16- HOUSE NO- 16- JAWAHAR GANJ. BITTARWAR ROAD- DABRA- DIST ┬û GWALIOR 475110,GWALIOR,DABRA,MADHYA PRADESH,0
