,BANK NAME,IFSC,OFFICE,ADDRESS,DISTRICT,CITY,STATE,PHONE
0,PRATHAMA BANK,PRTH0000001,RTGS-HO,"PRATHAMA BHAVAN, RAM GANGA VIHAR, MORADABAD",MORADABAD,MORADABAD,UTTAR PRADESH,2455177
1,PRATHAMA BANK,PRTH0000002,MOBILE BANKING,"PRATHAMA BANK HEAD OFFICE ,PRATHAMA BHAVAN,RAM GANGA VIHAR PHASE-II , MORADABAD , UP-244001",MORADABAD,MORADABAD,UTTAR PRADESH,2455179
2,PRATHAMA BANK,PRTH0011000,RO MORADABAD,"PRATHAMA BHAVAN, RAM GANGA VIHAR, MORADABAD",MORADABAD,MORADABAD,UTTAR PRADESH,9837001680
3,PRATHAMA BANK,PRTH0011009,AGHWANPUR,P.O. AGHWANPUR TEH. MORADABAD DISTT. MORADABAD.,MORADABAD,MORADABAD,UTTAR PRADESH,9756799009
4,PRATHAMA BANK,PRTH0011011,MOONDA PANDAY,P.O. MOONDA PANDAY TEH.MORADABAD DISTT. MORADABAD.,MORADABAD,MORADABAD,UTTAR PRADESH,9756799011
5,PRATHAMA BANK,PRTH0011012,PAKBARA,P.O. PAKBARA TEH.MORADABAD DISTT. MORADABAD.,MORADABAD,MORADABAD,UTTAR PRADESH,9756799012
6,PRATHAMA BANK,PRTH0011015,R. N SAHASPUR,P.O. R.N. SAHASPUR TEH.BILARI DISTT. MORADABAD.,MORADABAD,MORADABAD,UTTAR PRADESH,9756799015
7,PRATHAMA BANK,PRTH0011016,KUNDARKI,P.O. KUNDERKI TEH.BILARI DISTT. MORADABAD.,MORADABAD,MORADABAD,UTTAR PRADESH,9756799016
8,PRATHAMA BANK,PRTH0011025,MORADABAD MAIN,"A-77 GANDHI NAGAR, PRINCE ROAD, P.O. MORADABAD, DISTT MORADABAD",MORADABAD,MORADABAD,UTTAR PRADESH,9756799025
9,PRATHAMA BANK,PRTH0011026,SARKARAKHAS,P.O. SARKARA KHAS TEH.MORADABAD DISTT. MORADABAD,MORADABAD,MORADABAD,UTTAR PRADESH,9756799026
10,PRATHAMA BANK,PRTH0011030,FATEHPUR VISHNOI,P.O. FATHPUR VISHNOI TEHSIL KANTH DISTT. MORADABAD,MORADABAD,MORADABAD,UTTAR PRADESH,9756799030
11,PRATHAMA BANK,PRTH0011042,SEONDARA,"P.O. SEONDARA TEHSIL BILARI, DISTT. MORDABAD",MORADABAD,MORADABAD,UTTAR PRADESH,9756799042
12,PRATHAMA BANK,PRTH0011048,LODHIPUR JAWAHAR NAGAR,P.O. KAZIPURA TEHSIL. MORADABAD DISTT. MORADABAD,MORADABAD,MORADABAD,UTTAR PRADESH,9756799048
13,PRATHAMA BANK,PRTH0011052,HARTHALA,P.O. HARTHALA TEHSIL. & DISTT. MORADABAD,MORADABAD,MORADABAD,UTTAR PRADESH,9756799052
14,PRATHAMA BANK,PRTH0011055,JARGAON,P.O. JARGAON TEHSIL. CHANDAUSI DISTT. MORADABAD,MORADABAD,MORADABAD,UTTAR PRADESH,236244
15,PRATHAMA BANK,PRTH0011058,LALBAGH,P.O. MORDABAD TEHSIL.&DISTT. MORADABAD,MORADABAD,MORADABAD,UTTAR PRADESH,2497077
16,PRATHAMA BANK,PRTH0011059,KATGHAR,P.O. MAQBARA TEHSIL.MORDABAD DISTT. MORADABAD,MORADABAD,MORADABAD,UTTAR PRADESH,2490247
17,PRATHAMA BANK,PRTH0011060,TAJPUR MAAFI,P.O. BHANSIA TEHSIL. & DISTT. MORDABAD,MORADABAD,MORADABAD,UTTAR PRADESH,2390169
18,PRATHAMA BANK,PRTH0011063,SAKTOO NAGLA,P.O. SARKARA KHAS TEHSIL. & DISTT. MORADABAD,MORADABAD,MORADABAD,UTTAR PRADESH,9927030602
19,PRATHAMA BANK,PRTH0011065,AKKA DILARI,P.O. AKKA DILARI TEHSIL.& DISTT. MORADABAD,MORADABAD,MORADABAD,UTTAR PRADESH,5541660
20,PRATHAMA BANK,PRTH0011076,GWAROO,P.O. GWAROO TEHSIL.BILARI DISTT. MORADABAD,MORADABAD,MORADABAD,UTTAR PRADESH,259185
21,PRATHAMA BANK,PRTH0011077,KURADOOMNAGAR,P.O. K.D. NAGAR TEHSIL. BILARI DISTT. MORADABAD,MORADABAD,MORADABAD,UTTAR PRADESH,233253
22,PRATHAMA BANK,PRTH0011078,MAJHOLA LINE PAAR,P.O. MAJHOLA LINEPAR TEHSIL. & DISTT. MORADABAD,MORADABAD,MORADABAD,UTTAR PRADESH,2483032
23,PRATHAMA BANK,PRTH0011086,HUSSAINPUR CHIRAWALI,"GAGAN TIRAHA, P.O. SITAPURI┬á TEHSIL BILARI┬á DISTT. MORADABAD",MORADABAD,MORADABAD,UTTAR PRADESH,2357692
24,PRATHAMA BANK,PRTH0011100,BANGLA GAON,"P.O. KATCHAHRI, TEHSIL & DISTT. MORDABAD",MORADABAD,MORADABAD,UTTAR PRADESH,2420761
25,PRATHAMA BANK,PRTH0011109,KHADAGPUR BAJEY,P.O. MACHHARIYA RLY STATION TEHSIL. & DISTT. MORADABAD,MORADABAD,MORADABAD,UTTAR PRADESH,9927030604
26,PRATHAMA BANK,PRTH0011110,BAHORANPUR NARAULI,P.O. BAHORANPUR NAROLI VIA RAJAKA SAHASPUR TEHSIL.BILARI DISTT. MORADABAD,MORADABAD,MORADABAD,UTTAR PRADESH,9927030584
27,PRATHAMA BANK,PRTH0011138,MOHANPUR,P.O. KUNDERKI TEHSIL-BILARI DISTT. MORADABAD,MORADABAD,MORADABAD,UTTAR PRADESH,9927030572
28,PRATHAMA BANK,PRTH0011140,SANAI,P.O. SANAI TEHSIL-BILARI DISTT. MORADABAD,MORADABAD,MORADABAD,UTTAR PRADESH,9927030605
29,PRATHAMA BANK,PRTH0011146,BHEETKHERA,P.O. HIRAN KHERA TEHSIL & DISTT. MORADABD,MORADABAD,MORADABAD,UTTAR PRADESH,9927030598
30,PRATHAMA BANK,PRTH0011147,LALATEEKAR,P.O. RAONDA VIA KUNDERKI TEHSIL-BILARI DISTT. MORADABAD,MORADABAD,MORADABAD,UTTAR PRADESH,9756799147
31,PRATHAMA BANK,PRTH0011162,DHAKIA NARU,P.O. NIKAT SUGAR MILL BILARI TEHSIL-BILARI DISTT. MORADABAD,MORADABAD,MORADABAD,UTTAR PRADESH,270548
32,PRATHAMA BANK,PRTH0011165,BILLARI,NEAR MANGAL KA BAZAR DISTT. MORDABAD,MORADABAD,MORADABAD,UTTAR PRADESH,270151
33,PRATHAMA BANK,PRTH0011169,RAM GANGA VIHAR,"P.O. RAMGANGA VIHAR, TEHSIL & DISTT.MORADABAD",MORADABAD,MORADABAD,UTTAR PRADESH,2451075
34,PRATHAMA BANK,PRTH0011170,KARULA,"P.O. KARULA, THE & DISTT. MORADABAD",MORADABAD,MORADABAD,UTTAR PRADESH,2358433
35,PRATHAMA BANK,PRTH0011172,RAMPUR ROAD,"RAMPUR ROAD,DISTT:- MORADABAD",MORADABAD,MORADABAD,UTTAR PRADESH,9756799172
36,PRATHAMA BANK,PRTH0011175,TOWN HALL,"TOWN HALL BUDH BAZAR STN. ROAD MORADABAD,DISTT:- MORADABAD",MORADABAD,MORADABAD,UTTAR PRADESH,9756799175
37,PRATHAMA BANK,PRTH0011182,HAKEEMPUR,"VILL. HAKIMPUR, POST FATEHPUR VISHNOI, TEHSIL KANTH, DISTT, MORADABAD",MORADABAD,MORADABAD,UTTAR PRADESH,9756799182
38,PRATHAMA BANK,PRTH0011193,MANGUPURA,"VILL: MANGOOPURA,P.O. PAKBARA,TEHSIL MORADABAD,DISTT: MORADABAD┬á",MORADABAD,MORADABAD,UTTAR PRADESH,9756799193
39,PRATHAMA BANK,PRTH0011198,JALALPUR KHAS,"VILL:JALALPUR KHAS, P.O. KUNDERKI, TEHSIL: BILARI,DISTT: MORADABAD PIN-202413",MORADABAD,MORADABAD,UTTAR PRADESH,9756799198
40,PRATHAMA BANK,PRTH0011207,DEVAPUR MUSTEHKUM,"VILL. & POST DEVAPUR MUSTAKAM,TEHSIL-MORADABAD,DISTT-MORADABAD,",MORADABAD,MORADABAD,UTTAR PRADESH,9756799207
41,PRATHAMA BANK,PRTH0011213,CHHABRA,"VILL & POST CHHABRA,TEHSIL-CHANDAUSI, DISTT-MORADABAD, PIN-202411 (U.P)",MORADABAD,MORADABAD,UTTAR PRADESH,8057911213
42,PRATHAMA BANK,PRTH0011220,REETH,"VILL REETH POST DHARAMPUR RATTA,TEHSIL-CHANDAUSI,DISTT-MORADABAD, PIN-202411 (U.P)",MORADABAD,MORADABAD,UTTAR PRADESH,8449710220
43,PRATHAMA BANK,PRTH0011260,LAKRI FAZAL PUR,LAKRI FAZAL PUR PO LAKRI FAZAL PUR DISTT. MORADABAD-244001,MORADABAD,MORADABAD,UTTAR PRADESH,8191900260
44,PRATHAMA BANK,PRTH0011265,KHUSHAL PUR,"MOH.KHUSHALPUR,MORADABAD 244001",MORADABAD,MORADABAD,UTTAR PRADESH,0
45,PRATHAMA BANK,PRTH0011266,CHANGERI,"PO CHHIJLET,BLOCK CHHIJLET,DISTT MORADABAD 244501",MORADABAD,MORADABAD,UTTAR PRADESH,0
46,PRATHAMA BANK,PRTH0011277,KHANPUR MUZAFFARPUR,"PO AGHWANPUR, BLOCK CHHIJLET,DISTT MORADABAD-244504",MORADABAD,MORADABAD,UTTAR PRADESH,7534016277
47,PRATHAMA BANK,PRTH0011281,CHANDER NAGAR,"CHANDER NAGAR,MORADABAD-244001",MORADABAD,MORADABAD,UTTAR PRADESH,7534016281
48,PRATHAMA BANK,PRTH0011297,MORA MUSTAHKAM,VILL AND PO SONAKPUR BLOCK MORADABAD DISTRICT MORADABAD 244001,MORADABAD,MORADABAD,UTTAR PRADESH,7534016297
49,PRATHAMA BANK,PRTH0011300,SIMLATHER,PO KUNDERKI BLOCK KUNDERKI DISTRICT MORADABAD 244001,MORADABAD,MORADABAD,UTTAR PRADESH,7534016300
50,PRATHAMA BANK,PRTH0011302,DAULARI,PO AKKA DILARI BLOCK MOONDA PANDEYDISTRICT MORADABAD 244104,MORADABAD,MORADABAD,UTTAR PRADESH,7534016302
51,PRATHAMA BANK,PRTH0011303,NAVEEN NAGAR,NAVEEN NAGAR MDA KANTH ROAD MORADABAD,MORADABAD,MORADABAD,UTTAR PRADESH,7354016303
52,PRATHAMA BANK,PRTH0011305,SURYA NAGAR,MOH SURYA NAGAR MAJHOLA LINEPUR BLOCK AND TEHSIL MORADABAD,MORADABAD,MORADABAD,UTTAR PRADESH,7534016305
53,PRATHAMA BANK,PRTH0011319,BIBIPUR,VILL BIBIPUR POST SARAI KHAJOOR 244405 DISTT MORADABAD,MORADABAD,MORADABAD,UTTAR PRADESH,7055715319
54,PRATHAMA BANK,PRTH0011321,THAMWALA,VILL THAMWALA TEHSIL BILARI DISTT MORADABAD,MORADABAD,BILARI,UTTAR PRADESH,7055715321
55,PRATHAMA BANK,PRTH0011325,GOVINDPUR,VILL GOVINDPUR TEHSIL BILARI DISTT MORADABAD,MORADABAD,BILARI,UTTAR PRADESH,7055715325
56,PRATHAMA BANK,PRTH0011326,LAXMIPUR KATTAI,VILL LAXMIPUR KATTAI TEHSIL AND DISTT MORADABAD,MORADABAD,MORADABAD,UTTAR PRADESH,7055715326
57,PRATHAMA BANK,PRTH0011327,SATARAN,VILL SATARAN TEHSIL BILARI DISTT MBD,MORADABAD,BILARI,UTTAR PRADESH,7055715327
58,PRATHAMA BANK,PRTH0011328,KARANPUR,VILL KARANPUR DISTT MORADABAD,MORADABAD,MORADABAD,UTTAR PRADESH,7055715328
59,PRATHAMA BANK,PRTH0011356,SHERUA DHARAMPUR,VILL SHERUA DHARAMPUR DISTT MBD,MORADABAD,MORADABAD,UTTAR PRADESH,7055715356
60,PRATHAMA BANK,PRTH0011370,HASAMPUR CHAURAHA,"VILL.HASAMPUR CHAURAHA, PO PAKBARA, TEHSIL AND DISTT.MORADABAD",MORADABAD,MORADABAD,UTTAR PRADESH,7055715370
61,PRATHAMA BANK,PRTH0011386,SAINJANA,"BLOCK MOONDA PANDEY,TEH& DISTT. MORADABAD",MORADABAD,MORADABAD,UTTAR PRADESH,7055715386
62,PRATHAMA BANK,PRTH0011389,HAMEERPUR,"BLOCK BHOJPUR, P.O GODHI,DISTT.MORADABAD",MORADABAD,MORADABAD,UTTAR PRADESH,7055715389
63,PRATHAMA BANK,PRTH0011406,CHAKKAR KI MILAK,BLOCK TEHSIL DISTT MORADABAD PIN 244001,MORADABAD,MORADABAD,UTTAR PRADESH,7055715406
64,PRATHAMA BANK,PRTH0011407,HANUMAN MURTI,BLOCK KUNDERKI TEHSIL BILARI DISTT MORADABAD PIN 244001,MORADABAD,MORADABAD,UTTAR PRADESH,7055715407
65,PRATHAMA BANK,PRTH0011409,BHOLA SINGH KI MILAK,VILL BHOLA SINGH KI MILAK BLOCK AND TEHSIL MORADABAD DISTT MORADABAD,MORADABAD,MORADABAD,UTTAR PRADESH,7055715409
66,PRATHAMA BANK,PRTH0013000,RO THAKURDWARA,"PRATHAMA BANK RO, THANKURADWARA, MORADBAD",MORADABAD,MORADABAD,UTTAR PRADESH,9837001683
67,PRATHAMA BANK,PRTH0013006,SURJAN NAGAR,"P.O. SURJAN NAGAR,TEH. THAKURDWARA ┬áDISTT. MORADABAD.",MORADABAD,MORADABAD,UTTAR PRADESH,9756799006
68,PRATHAMA BANK,PRTH0013007,DILARI,"P.O. DILARI TEH., TEH.THAKURDWARA┬á,DISTT. MORADABAD.",MORADABAD,MORADABAD,UTTAR PRADESH,9756799007
69,PRATHAMA BANK,PRTH0013021,PEEPAL SANA,P.O. PEEPALSANA TEH.MORADABAD DISTT. MORADABAD.,MORADABAD,MORADABAD,UTTAR PRADESH,9756799021
70,PRATHAMA BANK,PRTH0013024,SULTANPUR DOST,P.O. SULTANPUR DOST TEH THAKURDWARA DISTT.MORADABAD,MORADABAD,MORADABAD,UTTAR PRADESH,9756799024
71,PRATHAMA BANK,PRTH0013045,SHARIF NAGAR,"P.O. SHAREEF NAGAR,TEHSIL THAKURDWARA,DISTT. MORADABAD",MORADABAD,MORADABAD,UTTAR PRADESH,9756799045
72,PRATHAMA BANK,PRTH0013046,JAHANGIRPUR,"P.O. JAHANGIRPUR, TEHSIL THAKURDWARA DISTT. MORADABAD",MORADABAD,MORADABAD,UTTAR PRADESH,9756799046
73,PRATHAMA BANK,PRTH0013050,RATUPURA,P.O. RATUPURA TEHSIL.THAKURDWARA DISTT. MORADABAD,MORADABAD,MORADABAD,UTTAR PRADESH,9756799050
74,PRATHAMA BANK,PRTH0013051,BHAGATPUR TANDA,P.O. BHAGATPUR TANDA TEHSIL.MORDABAD DISTT. MORADABAD,MORADABAD,MORADABAD,UTTAR PRADESH,9756799051
75,PRATHAMA BANK,PRTH0013061,MANPUR,P.O. MANPUR TEHSIL.MORDABAD DISTT. MORADABAD,MORADABAD,MORADABAD,UTTAR PRADESH,2254201
76,PRATHAMA BANK,PRTH0013067,KARANPUR,P.O. ALIABAD VIA DILARI TEHSIL. THAKURDWARA DISTT. MORADABAD,MORADABAD,MORADABAD,UTTAR PRADESH,2249669
77,PRATHAMA BANK,PRTH0013068,KAMALPURI,P.O. KALAJHANDA TEHSIL.THAKURDWARA DISTT. MORADABAD,MORADABAD,MORADABAD,UTTAR PRADESH,2241142
78,PRATHAMA BANK,PRTH0013080,THAKURDWARA,"P.O. & TEHSIL.THAKURDWARA , DISTT. MORADABAD",MORADABAD,MORADABAD,UTTAR PRADESH,2241244
79,PRATHAMA BANK,PRTH0013082,BUDHANPUR ALIGANJ,"P.O. B.P. ALIGANJ, TEHSIL. & DISTT. MORADABAD",MORADABAD,MORADABAD,UTTAR PRADESH,2250083
80,PRATHAMA BANK,PRTH0013085,DHAKIA,P.O. DHAKIA JAT TEHSIL. THAKURDWARA DISTT. MORADBAD,MORADABAD,MORADABAD,UTTAR PRADESH,2249815
81,PRATHAMA BANK,PRTH0013104,NANHOOWALA,P.O. NANHUWALA TEHSIL.THAKURDWARA DISTT. MORADABAD,MORADABAD,MORADABAD,UTTAR PRADESH,9927030643
82,PRATHAMA BANK,PRTH0013105,GOPIWALA,P.O. GOPIWALA TEHSIL. THAKURDWARA DISTT. MORADABAD,MORADABAD,MORADABAD,UTTAR PRADESH,9927030642
83,PRATHAMA BANK,PRTH0013106,MAHESHPUR KHEM,P.O. MANPUR TEHSIL & DISTT. MORADABD,MORADABAD,MORADABAD,UTTAR PRADESH,9927030645
84,PRATHAMA BANK,PRTH0013122,REHTA MAFI,P.O. REHTA MAFI TEHSIL- THAKURDWARA DISTT. MORADABAD,MORADABAD,MORADABAD,UTTAR PRADESH,2249490
85,PRATHAMA BANK,PRTH0013129,BAHERI BRAHAMNAN,P.O. BAHERI BRAHMANAN TEHSIL- THAKURDWARA DISTT. MORADABAD,MORADABAD,MORADABAD,UTTAR PRADESH,2247877
86,PRATHAMA BANK,PRTH0013130,TAGAWALA MANPUR,VIA MANPUR SABIT P.O. DILARI TEHSIL-THAKURDWARA DISTT. MORADABAD,MORADABAD,MORADABAD,UTTAR PRADESH,9927030606
87,PRATHAMA BANK,PRTH0013141,BAHADURNAGAR,P.O. BAHADUR NAGAR TEHSIL-THAKURDWARA DISTT. MORADABAD,MORADABAD,MORADABAD,UTTAR PRADESH,9927030644
88,PRATHAMA BANK,PRTH0013176,DULHAPUR,"P.O. TANDA AFZAL┬á,DISTT:- MORADABAD",MORADABAD,MORADABAD,UTTAR PRADESH,9927030667
89,PRATHAMA BANK,PRTH0013192,JATPURA,"POST OFFICE: RAJPUR KESARIA,TEHSIL THAKURDWARA,┬áDISTT: MORADABAD┬á PIN-244001",MORADABAD,MORADABAD,UTTAR PRADESH,9756799192
90,PRATHAMA BANK,PRTH0013211,CHANDPUR MUSTEHKUM,"VILL & POST CHANDPUR MUSTAKAM,TEHSIL-MORADABAD,DISTT-MORADABAD (U.P),",MORADABAD,MORADABAD,UTTAR PRADESH,8057911211
91,PRATHAMA BANK,PRTH0013214,KAZIPURA,"VILL. KAZIPUR POST DILARI,TEHSIL THAKURDWARA, DISTT-MORADABAD",MORADABAD,MORADABAD,UTTAR PRADESH,8449710214
92,PRATHAMA BANK,PRTH0013237,LONGI KALAN,"VILL. LONGI KALAN,P.O.LONIKALAN,TEHSEEL  THAKURDWARA  244601",MORADABAD,MORADABAD,UTTAR PRADESH,8476010237
93,PRATHAMA BANK,PRTH0013241,SARKARA KHAS (VISHNOI),"VILL.SARKARA KHAS P.O.SARKARAKHAS(VISHNOI) VIA DILARI,MORADABAD",MORADABAD,MORADABAD,UTTAR PRADESH,8476010241
94,PRATHAMA BANK,PRTH0013242,BARKHERA CHAK,"VILL. BARKHERA CHAK P.O.MANPURA,THAKURDWARA,MORADABAD",MORADABAD,MORADABAD,UTTAR PRADESH,8476010242
95,PRATHAMA BANK,PRTH0013244,KUA KHERA KHALSA,"VILL.KUA KHERA KHALSA POST SARIFF NAGAR,TEHSIL THAKURDWARA,MORADABAD",MORADABAD,MORADABAD,UTTAR PRADESH,8476010244
96,PRATHAMA BANK,PRTH0013245,EGRAHA,"VILL & PO EGRAHA, THESIL THAKURDWARA, DIST MORADABAD-244401",MORADABAD,MORADABAD,UTTAR PRADESH,8476010245
97,PRATHAMA BANK,PRTH0013250,RAM NAGAR KHAGGUWALA,"VILL RAM NAGAR KHAGUWALA, PO & BLOCK  THAKURDWARA DIST. MORADABAD-244601",MORADABAD,MORADABAD,UTTAR PRADESH,8191900250
98,PRATHAMA BANK,PRTH0013255,LALAPUR PEEPALSANA,"VILL & PO SHERPUR PATTI, BLOCK & TEHSIL THAKURDWARA DIST MORADABAD-244602",MORADABAD,MORADABAD,UTTAR PRADESH,8191900255
99,PRATHAMA BANK,PRTH0013256,TAH MADAN,"VILL TAH MADAN, PO UDMA WALA BLOCK BHAGATPUR TANDA, DISTT MORADABAD-244925",MORADABAD,MORADABAD,UTTAR PRADESH,8191900256
100,PRATHAMA BANK,PRTH0013257,CHATARPUR NAYAK,"VILL CHATARPUR NAYAK, PO MEVLA KALAN, BLOCK B.P. TANDA, DISTT. MORADABAD-244925",MORADABAD,MORADABAD,UTTAR PRADESH,8191900257
101,PRATHAMA BANK,PRTH0013262,RAGHUWALA,"POST RAGHUWALA,BLOCK THAKURDWARA,DIST MORADABAD 244601",MORADABAD,MORADABAD,UTTAR PRADESH,8191900262
102,PRATHAMA BANK,PRTH0013273,MANPUR DUTTRAM,"PO NANHOOWALA,BLOCK THAKURDWARA,DISTT MORADABAD 244601",MORADABAD,MORADABAD,UTTAR PRADESH,0
103,PRATHAMA BANK,PRTH0013274,MANKUA MAKSOODPUR,"PO SIDLAU NAZARPUR,BLOCK DILARI,DISTT MORADABAD 244402",MORADABAD,MORADABAD,UTTAR PRADESH,0
104,PRATHAMA BANK,PRTH0013275,RAJUPUR MILAK,"PO KISHANPUR GAMADI,BLOCK THAKURDWARA,MORADABAD",MORADABAD,MORADABAD,UTTAR PRADESH,0
105,PRATHAMA BANK,PRTH0013289,RAJUPUR KALAN,"VILL AND PO RAJUPUR KALAN,BLOCK THAKURDWARA,DISTRICT MORADABAD",MORADABAD,MORADABAD,UTTAR PRADESH,7534016289
106,PRATHAMA BANK,PRTH0013311,BAHERI,VILL BAHERI POST MANPUR 244924 DISTT MORADBAD,MORADABAD,MOARADABAD,UTTAR PRADESH,7055715311
107,PRATHAMA BANK,PRTH0013312,GAJRAULA SAID,VILL GAJRAULA SAID POST BAHERI BRAHMNAN 244402 DISTT MORADABAD,MORADABAD,MORADABAD,UTTAR PRADESH,7055715312
108,PRATHAMA BANK,PRTH0013329,ALIYABAD,VILL ALIYABAD TEHSIL THAKURDWARA DISTT MORADABAD,MORADABAD,THAKURDWARA,UTTAR PRADESH,7055715329
109,PRATHAMA BANK,PRTH0013330,SARKARA PARAM,VILL SARKARA PARAM TEHSIL THAKURDWARA DISTT. MORADABAD,MORADABAD,THAKURDWARA,UTTAR PRADESH,7055715330
110,PRATHAMA BANK,PRTH0013331,BHAIPUR,VILL BHAIPUR TEHSIL THAKURDWARA DISTT MORADABAD,MORADABAD,THAKURDWARA,UTTAR PRADESH,7055715331
111,PRATHAMA BANK,PRTH0013332,DHARA KA NAGLA,VILL DHARA KA NAGLA TEHSIL THAKURDWARA DISTT MORADABAD,MORADABAD,THAKURDWARA,UTTAR PRADESH,7055715332
112,PRATHAMA BANK,PRTH0013343,BHORANPUR KALAN,VILL BHORANPUR KALAN TEHSIL AND DISTT MBD,MORADABAD,MORADABAD,UTTAR PRADESH,7055715343
113,PRATHAMA BANK,PRTH0013347,ISLAM NAGAR CHAURAHA,ISLAM NAGAR CHAURAHA VILLAGE TESHIL AND DISTT.MBD,MORADABAD,THAKURDWARA,UTTAR PRADESH,7055715347
114,PRATHAMA BANK,PRTH0013353,MEHMOODPUR TIGRI,VILL MEHMOODPUR TIGRI PO LALUWALA TEHSIL THAKURDWARA DISTT MORADABAD,MORADABAD,THAKURDWARA,UTTAR PRADESH,7055715353
115,PRATHAMA BANK,PRTH0013355,NIWAR KHAS,VILL NIWAR KHAS PO MANPUR TEHSIL ANDDISTT MBD,MORADABAD,MORADABAD,UTTAR PRADESH,7055715355
116,PRATHAMA BANK,PRTH0013368,SARDAR NAGAR,"VILL. AND PO SARDAR NAGAR, BLOCK B.P. TANDA, TEHSIL-THAKURDWARA, DISTT. MORADABAD",MORADABAD,THAKURDWARA,UTTAR PRADESH,7055715368
117,PRATHAMA BANK,PRTH0013369,GAKKHARPUR,"GAKKHARPUR, BLOCK- DILARI, DISTT.MORADABAD",MORADABAD,MORADABAD,UTTAR PRADESH,7055715369
118,PRATHAMA BANK,PRTH0013394,BHOJPUR,VILL AND PO BHOJPUR BLOCK BP TANDA TEHSIL MORADABAD PIN 244402,MORADABAD,MORADABAD,UTTAR PRADESH,7055715394
119,PRATHAMA BANK,PRTH0013411,BITHOOATHER,VILL BITHOOATHER BLOCK DILARI TEHSIL THAKURDWARA DISTT MORADABAD,MORADABAD,MORADABAD,UTTAR PRADESH,7055715411
120,PRATHAMA BANK,PRTH0014010,CHHIJLET,P.O. CHHIJLET TEH.KANTH DISTT. MORADABAD.,MORADABAD,MORADABAD,UTTAR PRADESH,9756799010
121,PRATHAMA BANK,PRTH0014017,GARHEE SALEEMPUR,P.O. GARHI SALEMPUR TEH.KANTH DISTT. MORADABAD.,MORADABAD,MORADABAD,UTTAR PRADESH,9756799017
122,PRATHAMA BANK,PRTH0014018,UMARI KALAN,P.O. UMRI KALAN TEH.KANTH DISTT. MORADABAD.,MORADABAD,MORADABAD,UTTAR PRADESH,9756799018
123,PRATHAMA BANK,PRTH0014047,MADHAN,P.O. MADHAN TEHSIL. SAMBHAL┬áDISTT. MORADABAD,MORADABAD,MORADABAD,UTTAR PRADESH,9756799047
124,PRATHAMA BANK,PRTH0014054,LODHIPUR RAJPOOT,P.O. PAKBARA TEHSIL. & DISTT. MORADABAD,MORADABAD,MORADABAD,UTTAR PRADESH,2360477
125,PRATHAMA BANK,PRTH0014071,PAIGAMBERPUR,P.O. GAJANA TEHSIL. KANTH DISTT. MORADABAD,MORADABAD,MORADABAD,UTTAR PRADESH,275162
126,PRATHAMA BANK,PRTH0014079,MISHRIPUR,P.O. KANTH TEHSIL. KANTH DISTT. MORADABAD,MORADABAD,MORADABAD,UTTAR PRADESH,2221846
127,PRATHAMA BANK,PRTH0014107,MAGHPURI INAYATPURI,P.O. CHHIJLET VIA KANTH TEHSIL. KANTH DISTT. KANTH,MORADABAD,MORADABAD,UTTAR PRADESH,2330688
128,PRATHAMA BANK,PRTH0014132,NEKPUR,P.O. SAGHAN MACHERIA (VIA JOYA) TEHSIL-SAMBHAL DISTT. MORADABD,MORADABAD,MORADABAD,UTTAR PRADESH,9927030635
129,PRATHAMA BANK,PRTH0014145,MANAUTA,P.O. MANAUTA TEHSIL-SAMBHAL DISTT. MORADABAD,MORADABAD,MORADABAD,UTTAR PRADESH,9927030639
130,PRATHAMA BANK,PRTH0014164,KURI RAVANA,P.O. KURI RAWANA TEHSIL-KANTH DISTT.MORADABAD,MORADABAD,MORADABAD,UTTAR PRADESH,2225601
131,PRATHAMA BANK,PRTH0014177,KANTH,"P.O. KANTH,DISTT:- MORADABAD",MORADABAD,MORADABAD,UTTAR PRADESH,9927030559
132,PRATHAMA BANK,PRTH0014181,SAMADPUR,"VILL. SAMADPUR, POST SADARPUR, MATLABPUR, TEHSIL KANTH,DISTT,.MORADABAD",MORADABAD,MORADABAD,UTTAR PRADESH,9756799181
133,PRATHAMA BANK,PRTH0014212,SHAHBAJPUR KALAN,"VILL & POST SHAHBAZPUR KALAN, TEHSIL-SAMBHAL,DISTT-MORADABAD,",MORADABAD,MORADABAD,UTTAR PRADESH,8057911212
134,PRATHAMA BANK,PRTH0014221,GUMSANI,"VILL. & POST GUMSANI,BLOCK ASMOLI, TEHSIL SAMBHAL, DISTT-J.P.NAGAR,PIN-244255,(U.P)",MORADABAD,MORADABAD,UTTAR PRADESH,8449710221
135,PRATHAMA BANK,PRTH0014252,MUNDA KHERI,"VILL.& PO MUNDHA KHERI, BLOCK CHHIJLET, TEHSIL KANTH DIST MORADABAD-244221",MORADABAD,MORADABAD,UTTAR PRADESH,8191900252
136,PRATHAMA BANK,PRTH0014253,KOTHI KHIDMATPUR,"VILL. & PO KOTHI KHIDMATPUR, BLOCK CHHIJLET, TEHSIL KANTH DIST MORADABAD-244501",MORADABAD,MORADABAD,UTTAR PRADESH,8191900253
137,PRATHAMA BANK,PRTH0014259,BHAWALPUR WASLI,"BLOCK ASMOLI TEHSIL SAMBHAL,DISTT. MORADABAD",MORADABAD,MORADABAD,UTTAR PRADESH,8191900259
138,PRATHAMA BANK,PRTH0014313,PALLUPURA GHOSI,VILL PALLUPURA GHOSI PAKWARA 244102 DISTT MORADABAD,MORADABAD,MORADABAD,UTTAR PRADESH,7055715313
139,PRATHAMA BANK,PRTH0014314,MUBARAKPUR BAND,VILL MUBARAKPUR BAND POST KHASPUR 244102 DISTT SAMBHAL,SAMBHAL,SAMBHAL,UTTAR PRADESH,7055715314
140,PRATHAMA BANK,PRTH0014315,CHANDBAR,VILL CHANDBAD POST OBRI 244102 DISTT SAMBHAL,SAMBHAL,SAMBHAL,UTTAR PRADESH,7055715315
141,PRATHAMA BANK,PRTH0014316,MANDAWALI RASOOLPUR,MANDAWALI RASOOLPUR POST ASMOLI 244304 DISTT SAMBHAL,SAMBHAL,SAMBHAL,UTTAR PRADESH,7055715316
142,PRATHAMA BANK,PRTH0014337,NAYA GAON AKBARPUR CHENDRI,VILL NAYA GAON AKBARPUR CHENDRI TEHSIL KANTH DISTT MORADABAD,MORADABAD,MORADABAD,UTTAR PRADESH,7055715337
143,PRATHAMA BANK,PRTH0014339,BAGARPUR KALAN,VILL BAGARPUR KALAN TEHSIL KANTH DISTT MORADABAD,MORADABAD,KANTH,UTTAR PRADESH,7055715339
144,PRATHAMA BANK,PRTH0014361,JAHANGIRPUR CHAK FERI,"VILL AND PO JAHANGIRPUR CHAK FERI,TEHSIL KANTH,DISTT. MORADABAD",MORADABAD,AMROHA,UTTAR PRADESH,7055715361
145,PRATHAMA BANK,PRTH0014376,BABU KHERA,"VILL BABU KHERA.PO SAIDPUR GANGOO, TEHSIL AND DISTT.SAMBHAL",SAMBHAL,AMROHA,UTTAR PRADESH,7055715376
146,PRATHAMA BANK,PRTH0014383,SALEMPUR,"SALEMPUR,BLOCK-CHHIJLET, DISTT.MORADABAD",MORADABAD,MORADABAD,UTTAR PRADESH,7055715383
147,PRATHAMA BANK,PRTH0014410,RATUPUR,VILL RATUPUR BLOCK ASMOLI DISTT SAMBHAL,SAMBHAL,SAMBHAL,UTTAR PRADESH,7055715410
148,PRATHAMA BANK,PRTH0016000,RO SAMBHAL,"PRATHAMA BANK RO, SAMBHAL, NEAR SANKAR COLLEGE, SAMBHAL",MORADABAD,MORADABAD,UTTAR PRADESH,9837001684
149,PRATHAMA BANK,PRTH0016003,SIRSI,"MOH. SADAQ SARAI, P.O. SIRSI,┬áTEH. SAMBHAL DISTT. MORADABAD.",MORADABAD,MORADABAD,UTTAR PRADESH,9756799003
150,PRATHAMA BANK,PRTH0016004,PAWANSA,"VILL. PAWANSA, P.O. PAWANSA, TEH.SAMBHAL, DISTT. MORADABAD.",MORADABAD,MORADABAD,UTTAR PRADESH,9756799004
151,PRATHAMA BANK,PRTH0016014,SARAITAREEN,P.O. SARAI TAREEN P.O. SAMBHAL DISTT. MORADABAD.,MORADABAD,MORADABAD,UTTAR PRADESH,9756799014
152,PRATHAMA BANK,PRTH0016019,ASMOLI,P.O. ASMOLI TEH.SAMBHAL DISTT. MORADABAD.,MORADABAD,MORADABAD,UTTAR PRADESH,9756799019
153,PRATHAMA BANK,PRTH0016027,GUMTHAL,"BAHJOI ROAD, CHANDAUSI , TEHSIL CHANDAUSI DISTT. MORADABAD",MORADABAD,MORADABAD,UTTAR PRADESH,9756799027
154,PRATHAMA BANK,PRTH0016028,DEENGARPUR,"P.O. DINGERPUR TEHSIL BILARI, DISTT. MORADABAD",MORADABAD,MORADABAD,UTTAR PRADESH,9756799028
155,PRATHAMA BANK,PRTH0016031,KAITHAL,P.O. KAITHAL TEHSIL CHANDAUSI DISTT. MORADABAD,MORADABAD,MORADABAD,UTTAR PRADESH,9756799031
156,PRATHAMA BANK,PRTH0016032,MANJHOLA RAJA KA,P.O. MAJHOLA RAJA KA TEHSIL CHANDAUSI DISTT. MORADABAD,MORADABAD,MORADABAD,UTTAR PRADESH,9756799032
157,PRATHAMA BANK,PRTH0016033,PATHAKPUR,P.O. PATHAKPUR TEHSIL CHANDAUSI DISTT. MORADABAD,MORADABAD,MORADABAD,UTTAR PRADESH,9756799033
158,PRATHAMA BANK,PRTH0016035,SINGPUR SAINI,P.O. SINGHPUR SANI TEHSIL SAMBHAL DISTT. MORADABAD,MORADABAD,MORADABAD,UTTAR PRADESH,9756799035
159,PRATHAMA BANK,PRTH0016041,MOHDPUR TANDA,"P.O. MOHDPUR TANDA, TEHSIL SAMBHAL┬á DISTT. MORADABAD",MORADABAD,MORADABAD,UTTAR PRADESH,9756799041
160,PRATHAMA BANK,PRTH0016049,LAKHORI JALALPUR,P.O. LAKHORI JALALPUR TEHSIL.SAMBHAL DISTT. MORADABAD,MORADABAD,MORADABAD,UTTAR PRADESH,9756799049
161,PRATHAMA BANK,PRTH0016053,BHAWANIPUR,P.O. BHAWANIPUR TEHSIL.SAMBHAL DISTT. MORADABAD,MORADABAD,MORADABAD,UTTAR PRADESH,9756799053
162,PRATHAMA BANK,PRTH0016056,BANIAKHERA,P.O. BANIAKHERA TEHSIL.CHANDAUSI DISTT. MORADABAD,MORADABAD,MORADABAD,UTTAR PRADESH,9927030579
163,PRATHAMA BANK,PRTH0016062,MAUKATHER,P.O. MAUKATHER TEHSIL. CHANDAUSI DISTT. MORADABAD,MORADABAD,MORADABAD,UTTAR PRADESH,9927030582
164,PRATHAMA BANK,PRTH0016064,MAINATHER,P.O. MAINATHER┬á TEHSIL.BILARI DISTT. MORADABAD,MORADABAD,MORADABAD,UTTAR PRADESH,9927030567
165,PRATHAMA BANK,PRTH0016074,JANETA,P.O. JANETA TEHSIL.CHANDAUSI DISTT. MORDABAD,MORADABAD,MORADABAD,UTTAR PRADESH,246465
166,PRATHAMA BANK,PRTH0016075,DAROLI AFZALPUR,P.O. ┬ûDAROLI AFZALPUR VIA NAROLI TEHSIL.CHANDAUSI DISTT.MORADABAD,MORADABAD,MORADABAD,UTTAR PRADESH,9927030576
167,PRATHAMA BANK,PRTH0016083,CHANDAUSI,"P.O. & TEHSIL. CHANDAUSI, DISTT. MORADABAD",MORADABAD,MORADABAD,UTTAR PRADESH,250355
168,PRATHAMA BANK,PRTH0016084,AMARPUR KASHI,"P.O. AMARPUR KASHI TEHSIL, BILARI DISTT. MORDABAD",MORADABAD,MORADABAD,UTTAR PRADESH,9927030580
169,PRATHAMA BANK,PRTH0016087,SAUDHAN MOHAMMADPUR,"P.O. SODHAN MOHD.PUR TEHSIL- SAMBHAL, DISTT. MORADABAD",MORADABAD,MORADABAD,UTTAR PRADESH,9927030663
170,PRATHAMA BANK,PRTH0016088,SAMBHAL,"NEAR ROADWAYS BUS STAND P.O. SAMBHAL, TEHSIL. SAMBHAL┬á DISTT. MORADABAD",MORADABAD,MORADABAD,UTTAR PRADESH,230251
171,PRATHAMA BANK,PRTH0016101,BERNI,"P.O. BERNI, TEHSIL- CHANDAUSI DISTT. MORADABAD",MORADABAD,MORADABAD,UTTAR PRADESH,233271
172,PRATHAMA BANK,PRTH0016111,MOHDPUR WABAI,P.O. M.P. WABAI TEHSIL. CHANDAUSI DISTT. MORADABD,MORADABAD,MORADABAD,UTTAR PRADESH,246222
173,PRATHAMA BANK,PRTH0016112,KHIRNI MOINUDDINPUR,P.O. AMAWATI KUTUBPUR TEHSIL. SAMBHAL DISTT. MORADABAD,MORADABAD,MORADABAD,UTTAR PRADESH,9927030664
174,PRATHAMA BANK,PRTH0016113,RAMPUR URF YARPUR,"P.O. RAMPUR URF YARPUR,TEHSIL. SAMBHAL DISTT. MORADABAD",MORADABAD,MORADABAD,UTTAR PRADESH,9927030562
175,PRATHAMA BANK,PRTH0016123,MADALA FATEHPUR,P.O. ASMOLI TEH. SAMBHAL DISTT. MORADABAD,MORADABAD,MORADABAD,UTTAR PRADESH,9927030563
176,PRATHAMA BANK,PRTH0016167,NARAULI,"MAIN MARKET, TEHSIL- CHANDAUSI DISTT. MORDABAD",MORADABAD,MORADABAD,UTTAR PRADESH,246423
177,PRATHAMA BANK,PRTH0016178,BEHJOI,"TEHSIL SAMBHAL,DISTT: MORADABAD.",MORADABAD,MORADABAD,UTTAR PRADESH,243377
178,PRATHAMA BANK,PRTH0016194,ASALATPUR JARAI,"POST OFFICE:ASALATPUR JARAI,TEHSIL CHANDAUSI,┬áDISTT: MORADABAD",MORADABAD,MORADABAD,UTTAR PRADESH,9756799194
179,PRATHAMA BANK,PRTH0016210,MEHMOODPUR MAFI,"VILL-MEHMOODPUR MAFI,POST.-SIRSI,TEHSIL-BILARI,DISTT-MORADABAD,",MORADABAD,MORADABAD,UTTAR PRADESH,8057911210
180,PRATHAMA BANK,PRTH0016224,KHAGUPURA,"VILL.KHABUPURA,P.O.SAMBHAL,BHEEM NAGAR",MORADABAD,MORADABAD,UTTAR PRADESH,8449710224
181,PRATHAMA BANK,PRTH0016227,PATHARA,"VILL. PATHARA P.O. MAI,TEHSIL-CHANDAUSI, DISTT-BHEEM NAGAR",MORADABAD,MORADABAD,UTTAR PRADESH,8449710227
182,PRATHAMA BANK,PRTH0016228,NOORAI SARAI,"VILL. NOORAI SARAI P.O.MEERIYASARAI,TEHSEEL SAMBHAL,BHEEM NAGAR",MORADABAD,MORADABAD,UTTAR PRADESH,8449710228
183,PRATHAMA BANK,PRTH0016229,TANDA KOTHI,"VILL. TANDA KOTHI P.O.KHASPUR,TEHSEEL SAMBHAL,BHEEM NAGAR",MORADABAD,MORADABAD,UTTAR PRADESH,8449710229
184,PRATHAMA BANK,PRTH0016238,BABINA,"VILL. BABINA,P.O.MOHARA RATUPURA,BHEEM NAGAR",MORADABAD,MORADABAD,UTTAR PRADESH,8476010238
